question_id,category,subcategory,question,answer,options_json,contexts_json,parse_status,context_day,context_start,context_end,context_start_hms,context_end_hms,agents_in_context,parsed_contexts_json,provisional_query_user,query_user_status,current_only_answerability,history_only_answerability,current_plus_history_answerability,current_plus_history_gain,evidence_scope_bucket,best_evidence_scope,best_current_evidence_summary,best_history_evidence_summary,best_current_plus_history_summary,reason,needs_user_check,current_only_top_score,history_only_top_score,current_plus_history_top_score,current_only_answer_coverage,history_only_answer_coverage,current_plus_history_answer_coverage,current_only_question_overlap,history_only_question_overlap,current_plus_history_question_overlap,current_only_answer_hits,history_only_answer_hits,current_plus_history_answer_hits,is_global_or_temporal,is_pure_global_statistical,current_pool_size,history_pool_size,current_plus_history_pool_size
20,social_interaction,single_span,Who laughed the most during the conversation about who the water bottle belonged to?,It was mostly Jake who found it hilarious.,"[""It was mostly Jake who found it hilarious."", ""Nobody really laughed during this part."", ""Lucia laughed lightly while arranging flowers."", ""Alice found it amusing while watching Katrina."", ""Katrina found it funniest when Jake teased.""]","{""DAY1_19250000_19300000"": [""JAKE"", ""ALICE"", ""TASHA"", ""LUCIA"", ""KATRINA""]}",ok,1,69900.0,70200.0,19:25:00.00,19:30:00.00,Jake;Alice;Tasha;Lucia;Katrina,"[{""day"": 1, ""end_time"": 70200.0, ""raw"": ""DAY1_19250000_19300000"", ""start_time"": 69900.0}]",UNKNOWN,unknown,partially_answerable,likely_answerable,likely_answerable,yes,tier_B_promising_history_gain,current_plus_historical,"[current_only rank=1 score=9.9849 source=Jake D1 19:26:00.00-19:26:30.00 30sec] I see Alice placing flowers on the table, commenting on the quantity given. Katrina questions whose water bottle it is and suggests using it to water the plants. I chuckle to myself, ""Hehehe... Hahahahaha."" Alice states she just opened the water, and laughs... || [current_only rank=2 score=9.7299 source=Jake D1 19:25:30.00-19:26:00.00 30sec] The video begins with me standing at a table cluttered with unwashed plates, surrounded by others. Jake initiates the conversation, followed by Lucia suggesting dilution. I observe the dirty dishes and overhear Katrina recommending 0.3 liters of water per p... || [current_only rank=3 score=9.1938 source=Lucia D1 19:30:30.00-19:31:00.00 30sec] the video begins with a discussion about ordering a crab pot, with Katrina suggesting it, but pointing out that they contain mostly potatoes and very little meat. Tasha responds that it sounds delicious, while Alice sits, seeming a bit dazed, and asks ""Whic...","[history_only rank=1 score=16.2313 source=Lucia D1 13:31:30.00-13:32:00.00 30sec] the video begins with me making space on a table covered in a red and white checkered tablecloth, laden with various items. I state, ""Move this a bit,"" as I move a black box, followed by, ""This is mine,"" and ""My glasses case,"" indicating ownership of the it... || [history_only rank=2 score=15.6238 source=Alice D1 13:11:00.00-13:11:30.00 30sec] we're sitting around a table covered in a red and white checkered tablecloth, working on a wooden jigsaw puzzle that seems mostly complete. Jake initiates the discussion by asking, ""Who did this belong to?"", to which Tasha responds, ""This doesn't belong to... || [history_only rank=3 score=14.7034 source=Tasha D1 12:18:30.00-12:19:00.00 30sec] I was sitting at the table, listening to Shure talking about free time and how everyone can perform. Katrina confirmed it, saying ""Correct."" Shure then mentioned that it would be ""one and a half hours."" He continued by adding, ""Then we can auction off stuff...","[current_plus_historical rank=1 score=16.1230 source=Lucia D1 13:31:30.00-13:32:00.00 30sec] the video begins with me making space on a table covered in a red and white checkered tablecloth, laden with various items. I state, ""Move this a bit,"" as I move a black box, followed by, ""This is mine,"" and ""My glasses case,"" indicating ownership of the it... || [current_plus_historical rank=2 score=15.4916 source=Alice D1 13:11:00.00-13:11:30.00 30sec] we're sitting around a table covered in a red and white checkered tablecloth, working on a wooden jigsaw puzzle that seems mostly complete. Jake initiates the discussion by asking, ""Who did this belong to?"", to which Tasha responds, ""This doesn't belong to... || [current_plus_historical rank=3 score=14.5100 source=Lucia D1 12:30:00.00-12:40:00.00 10min] I found myself engrossed in a frustrating yet hilarious group activity: assembling a wooden jigsaw puzzle with intricate animal patterns and a red and white checkered table cloth. Right from the start, we were all stumped by the difficulty, questioning whet... || [current_plus_historical rank=4 score=14.4808 source=Tasha D1 12:18:30.00-12:19:00.00 30sec] I was sitting at the table, listening to Shure talking about free time and how everyone can perform. Katrina confirmed it, saying ""Correct."" Shure then mentioned that it would be ""one and a half hours."" He continued by adding, ""Then we can auction off stuff...","current=partially_answerable (global/statistical/temporal question; captions mention answer-related terms but may not cover enough events to verify the full comparison/order; answer_hits=found,it,jake,mostly,who; coverage=0.83; q_overlap=7) | history=likely_answerable (global/statistical/temporal question with unusually broad answer-keyword and question coverage in captions; answer_hits=found,hilariou,it,jake,mostly,who; coverage=1.00; q_overlap=7) | current+history=likely_answerable (global/statistical/temporal question with unusually broad answer-keyword and question coverage in captions; answer_hits=found,hilariou,it,jake,mostly,who; coverage=1.00; q_overlap=7) | gain=yes | bucket=tier_B_promising_history_gain | global/statistical/temporal question handled conservatively | caption-only heuristic; not a final label and not answer accuracy",yes,9.9849,16.2313,16.1230,0.8333,1.0000,1.0000,7,7,7,found;it;jake;mostly;who,found;hilariou;it;jake;mostly;who,found;hilariou;it;jake;mostly;who,yes,no,110,3122,3207
156,social_interaction,single_span,Why did Alice remove her glasses during the conversation?,Shure told her to restart them to fix the issue.,"[""She was teasing Shure about his suggestions."", ""She wanted to clean them after noticing dust."", ""Jake accidentally broke them and she reacted."", ""She was stretching and adjusting her posture."", ""Shure told her to restart them to fix the issue.""]","{""DAY4_10450000_10500000"": [""JAKE"", ""SHURE""]}",ok,4,38700.0,39000.0,10:45:00.00,10:50:00.00,Jake;Alice;Shure,"[{""day"": 4, ""end_time"": 39000.0, ""raw"": ""DAY4_10450000_10500000"", ""start_time"": 38700.0}]",Alice,inferred_weak,partially_answerable,likely_answerable,likely_answerable,yes,tier_B_promising_history_gain,current_plus_historical,"[current_only rank=1 score=7.0335 source=Jake D4 10:48:30.00-10:49:00.00 30sec] I am currently looking at a message on my phone while Shure is also looking at it. I quit something again, and I take a quick look at Shure. I then start walking over towards Alice, who is in another part of the room. Alice asks, ""Why is the button to start... || [current_only rank=2 score=6.4915 source=Jake D4 10:40:00.00-10:50:00.00 10min] I started by scrolling through WeChat on my phone, checking my messages with Shure next to me doing the same. We both looked at one message together. Then, I quit out of something on my phone and walked over to Alice. She was having trouble with her glasses... || [current_only rank=3 score=3.5243 source=Jake D4 10:49:00.00-10:49:30.00 30sec] I am currently in my bedroom, presumably looking for something, as the camera’s point of view shifts slightly around the room. I take a sip of water from a clear plastic bottle, and then I twist the cap closed. I subsequently place the water bottle on the c...","[history_only rank=1 score=23.3066 source=Shure D1 13:01:30.00-13:02:00.00 30sec] Alright, here's what happened today, captured from my point of view. First, Lucia pointed out a network error and adjusted her glasses while expressing her confusion about the sudden issue. Jake, in response, offered to investigate the problem. Next, my foc... || [history_only rank=2 score=14.9085 source=Alice D3 20:35:30.00-20:36:00.00 30sec] I began by taking a bite of pizza inside before heading outside. I proceeded to pick up the barbecue grill and carry it as I walk towards the glass door. I then opened the glass door and stepped outside into the courtyard. I announced my arrival, stating, ""... || [history_only rank=3 score=13.6972 source=Jake D1 11:10:00.00-11:20:00.00 10min] the meeting started with me having everyone mark their attendance on my phone. After that, we were figuring out what to do on our last day. I brought out a little tripod, thinking it might help with the discussion, but Shure suggested we look at some hard d...","[current_plus_historical rank=1 score=23.2384 source=Shure D1 13:01:30.00-13:02:00.00 30sec] Alright, here's what happened today, captured from my point of view. First, Lucia pointed out a network error and adjusted her glasses while expressing her confusion about the sudden issue. Jake, in response, offered to investigate the problem. Next, my foc... || [current_plus_historical rank=2 score=14.9036 source=Alice D3 20:35:30.00-20:36:00.00 30sec] I began by taking a bite of pizza inside before heading outside. I proceeded to pick up the barbecue grill and carry it as I walk towards the glass door. I then opened the glass door and stepped outside into the courtyard. I announced my arrival, stating, ""... || [current_plus_historical rank=3 score=13.9887 source=Jake D4 10:48:30.00-10:49:00.00 30sec] I am currently looking at a message on my phone while Shure is also looking at it. I quit something again, and I take a quick look at Shure. I then start walking over towards Alice, who is in another part of the room. Alice asks, ""Why is the button to start... || [current_plus_historical rank=4 score=13.6936 source=Jake D1 11:10:00.00-11:20:00.00 10min] the meeting started with me having everyone mark their attendance on my phone. After that, we were figuring out what to do on our last day. I brought out a little tripod, thinking it might help with the discussion, but Shure suggested we look at some hard d...","current=partially_answerable (evidence covers some answer keywords but may not fully support the answer; answer_hits=restart,shure,to; coverage=0.50; q_overlap=4) | history=likely_answerable (evidence covers most answer keywords and overlaps with the question context; answer_hits=fix,issue,restart,shure,to,told; coverage=1.00; q_overlap=4) | current+history=likely_answerable (evidence covers most answer keywords and overlaps with the question context; answer_hits=fix,issue,restart,shure,to,told; coverage=1.00; q_overlap=5) | gain=yes | bucket=tier_B_promising_history_gain | caption-only heuristic; not a final label and not answer accuracy",yes,7.0335,23.3066,23.2384,0.5000,1.0000,1.0000,4,4,5,restart;shure;to,fix;issue;restart;shure;to;told,fix;issue;restart;shure;to;told,no,no,25,7646,7671
538,task_coordination,single_span,"So, who was mostly handling drinks while everyone else seemed busy with other stuff?",Tasha was pouring and prepping the drinks repeatedly.,"[""Shure handled and distributed drinks for the group."", ""Jake decided he’d take over as the drink handler."", ""Tasha was pouring and prepping the drinks repeatedly."", ""Lucia was dealing with drinks for everyone the entire time."", ""Alice was organizing the drinks while everyone chatted.""]","{""DAY3_22500000_22550000"": [""JAKE"", ""TASHA"", ""LUCIA""]}",ok,3,82200.0,82500.0,22:50:00.00,22:55:00.00,Jake;Tasha;Lucia,"[{""day"": 3, ""end_time"": 82500.0, ""raw"": ""DAY3_22500000_22550000"", ""start_time"": 82200.0}]",UNKNOWN,unknown,partially_answerable,likely_answerable,likely_answerable,yes,tier_B_promising_history_gain,current_plus_historical,"[current_only rank=1 score=8.2509 source=Tasha D3 22:51:00.00-22:51:30.00 30sec] The video begins with me at a table with others outside in the evening. I'm speaking to Alice and asking, ""If you don't drink...I think you can have this drink, right?"". I then look ahead into the darkness. I say ""Can you pass me the cup? An empty cup."" and... || [current_only rank=2 score=7.1572 source=Tasha D3 22:50:00.00-23:00:00.00 10min] I was outside with friends in the evening, enjoying a relaxed time. I started by offering a drink to Alice and asking for an empty cup to pour something, which Lucia offered. I stood up, offering to wash the cup myself, and headed inside to grab a cup and s... || [current_only rank=3 score=6.7441 source=Lucia D3 22:40:00.00-22:50:00.00 10min] the afternoon started in the kitchen with a bit of strawberry cutting – I made a comment about the asymmetry of one and Tasha playfully called me talented. Lucia offered to get more strawberries. Soon enough, I was carrying a plate of sliced strawberries ov...","[history_only rank=1 score=16.1119 source=Tasha D1 14:14:30.00-14:15:00.00 30sec] The scene unfolds outdoors on a patio, where I'm seated at a wooden table with several others. Initially, I survey the group before shifting a dish slightly and moving some papers on the table. I then inquire, ""Tasha: Why did 6 people only order 4 drinks?"".... || [history_only rank=2 score=14.8003 source=Tasha D2 11:03:00.00-11:03:30.00 30sec] captured at 11:03 AM, I observe that all of the drink has already been dug out, prompting Alice to say, ""Ah, because I want to drink it cold."" I note that the pot has become burnt. Lucia responds to Alice, ""If you want it cold, we have more."" Alice replies,... || [history_only rank=3 score=14.4733 source=Tasha D1 13:51:30.00-13:52:00.00 30sec] Alright, I struggled to open the drink. Shure mentioned it was grapefruit flavored and we were putting them in the pool, so I took off the label of the can. Shure then said that we can't drink these, that they're just backup drinks. Alice asked if they need...","[current_plus_historical rank=1 score=16.0990 source=Tasha D1 14:14:30.00-14:15:00.00 30sec] The scene unfolds outdoors on a patio, where I'm seated at a wooden table with several others. Initially, I survey the group before shifting a dish slightly and moving some papers on the table. I then inquire, ""Tasha: Why did 6 people only order 4 drinks?"".... || [current_plus_historical rank=2 score=14.7808 source=Tasha D2 11:03:00.00-11:03:30.00 30sec] captured at 11:03 AM, I observe that all of the drink has already been dug out, prompting Alice to say, ""Ah, because I want to drink it cold."" I note that the pot has become burnt. Lucia responds to Alice, ""If you want it cold, we have more."" Alice replies,... || [current_plus_historical rank=3 score=14.4619 source=Tasha D1 13:51:30.00-13:52:00.00 30sec] Alright, I struggled to open the drink. Shure mentioned it was grapefruit flavored and we were putting them in the pool, so I took off the label of the can. Shure then said that we can't drink these, that they're just backup drinks. Alice asked if they need... || [current_plus_historical rank=4 score=14.3894 source=Tasha D2 21:01:30.00-21:02:00.00 30sec] Alright, here's what happened: I walked over to the table after hearing Tasha say, ""Wow, Daxi didn't do it on purpose,"" followed by Alice repeating the same sentiment. I then proceeded to open a milk cap. I heard Tasha say, ""Mama-san,"" and Alice responded w...","current=partially_answerable (evidence covers some answer keywords but may not fully support the answer; answer_hits=and,drink,pour,tasha; coverage=0.67; q_overlap=4) | history=likely_answerable (evidence covers most answer keywords and overlaps with the question context; answer_hits=and,drink,pour,prepp,repeatedly,tasha; coverage=1.00; q_overlap=5) | current+history=likely_answerable (evidence covers most answer keywords and overlaps with the question context; answer_hits=and,drink,pour,prepp,repeatedly,tasha; coverage=1.00; q_overlap=6) | gain=yes | bucket=tier_B_promising_history_gain | caption-only heuristic; not a final label and not answer accuracy",yes,8.2509,16.1119,16.0990,0.6667,1.0000,1.0000,4,5,6,and;drink;pour;tasha,and;drink;pour;prepp;repeatedly;tasha,and;drink;pour;prepp;repeatedly;tasha,no,no,40,7507,7529
673,task_coordination,single_span,How was task execution around soup preparation managed?,Lucia handled it while organizing bowls and adding condiments.,"[""Tasha ensured additional soup was ordered by coordinating delivery."", ""Katrina handled boiling and serving duties independently."", ""Alice focused on distributing utensils for the meal setup."", ""Jake took initiative by ensuring everyone had their servings."", ""Lucia handled it while organizing bowls and adding condiments.""]","{""DAY6_10400000_10450000"": [""JAKE"", ""ALICE"", ""TASHA"", ""LUCIA"", ""KATRINA"", ""SHURE""]}",ok,6,38400.0,38700.0,10:40:00.00,10:45:00.00,Jake;Alice;Tasha;Lucia;Katrina;Shure,"[{""day"": 6, ""end_time"": 38700.0, ""raw"": ""DAY6_10400000_10450000"", ""start_time"": 38400.0}]",UNKNOWN,unknown,partially_answerable,likely_answerable,likely_answerable,yes,tier_B_promising_history_gain,current_plus_historical,"[current_only rank=1 score=8.4397 source=Lucia D6 10:39:30.00-10:40:00.00 30sec] the video starts with Shure mentioning, ""We're very efficient at work,"" while I'm at a table laden with dishes and bowls, presumably after a meal. Tasha then says, ""Oh, it's you,"" as she walks around the table, inquiring, ""Just wanted to see which guy it is... || [current_only rank=2 score=6.6787 source=Tasha D6 10:45:00.00-10:45:30.00 30sec] I began typing on my smartphone. Initially, I was ready to engage in a typing task, but the necessary information or prompt was missing; however, I continued regardless. I proceeded to type several words on the screen of my phone, indicating my engagement i... || [current_only rank=3 score=5.4108 source=Lucia D6 10:30:00.00-10:40:00.00 10min] here's what happened in that ten-minute slice of time: I started out at the sink, washing some dishes and hearing someone whistle. I washed a bowl, emptied the sink, and then walked towards the hall with the clean bowl, only to find everyone was gone. I gra...","[history_only rank=1 score=16.7455 source=Alice D1 20:20:00.00-20:30:00.00 10min] Alright, so I was in the kitchen, and it was a whole cooking adventure. I had grabbed something, maybe a food item I'd been worried about washing down the drain, and I started prepping a head of cabbage. Alice rinsed the cutting board for me, and we realize... || [history_only rank=2 score=16.1107 source=Jake D1 20:45:00.00-20:45:30.00 30sec] the video starts with me focusing on the computer display located on the ground. I'm organizing the wires connected to the computer, with a voice saying ""Tasha: Just put it there."" and ""Tasha: Put it on the table."" There's also a discussion about whether th... || [history_only rank=3 score=16.0287 source=Tasha D4 18:48:00.00-18:48:30.00 30sec] I am sitting at a table with two boxes of seasoning. I begin by tearing off the plastic wrap from both boxes. I then open the lid of one of the seasoning containers. Next, I pick up a set of condiments and chopsticks. I start adding the seasoning to my bowl...","[current_plus_historical rank=1 score=16.7357 source=Alice D1 20:20:00.00-20:30:00.00 10min] Alright, so I was in the kitchen, and it was a whole cooking adventure. I had grabbed something, maybe a food item I'd been worried about washing down the drain, and I started prepping a head of cabbage. Alice rinsed the cutting board for me, and we realize... || [current_plus_historical rank=2 score=16.1023 source=Jake D1 20:45:00.00-20:45:30.00 30sec] the video starts with me focusing on the computer display located on the ground. I'm organizing the wires connected to the computer, with a voice saying ""Tasha: Just put it there."" and ""Tasha: Put it on the table."" There's also a discussion about whether th... || [current_plus_historical rank=3 score=16.0259 source=Tasha D4 18:48:00.00-18:48:30.00 30sec] I am sitting at a table with two boxes of seasoning. I begin by tearing off the plastic wrap from both boxes. I then open the lid of one of the seasoning containers. Next, I pick up a set of condiments and chopsticks. I start adding the seasoning to my bowl... || [current_plus_historical rank=4 score=15.7549 source=Alice D1 20:27:30.00-20:28:00.00 30sec] The video begins with Lucia commenting that something probably ran out of battery and we need to keep charging it. I then proceed to open the plug in the sink. I pour the foam into the sink. After this, I turn on the faucet to fill the sink. Jake then comme...","current=partially_answerable (evidence covers some answer keywords but may not fully support the answer; answer_hits=add,and,bowls,it,lucia; coverage=0.62; q_overlap=3) | history=likely_answerable (evidence covers most answer keywords and overlaps with the question context; answer_hits=add,and,bowls,condiment,handl,it,lucia,organiz; coverage=1.00; q_overlap=3) | current+history=likely_answerable (evidence covers most answer keywords and overlaps with the question context; answer_hits=add,and,bowls,condiment,handl,it,lucia,organiz; coverage=1.00; q_overlap=3) | gain=yes | bucket=tier_B_promising_history_gain | caption-only heuristic; not a final label and not answer accuracy",yes,8.4397,16.7455,16.7357,0.6250,1.0000,1.0000,3,3,3,add;and;bowls;it;lucia,add;and;bowls;condiment;handl;it;lucia;organiz,add;and;bowls;condiment;handl;it;lucia;organiz,no,no,132,24911,25007
