question_id,category,subcategory,question,answer,options_json,contexts_json,parse_status,context_day,context_start,context_end,context_start_hms,context_end_hms,agents_in_context,parsed_contexts_json,provisional_query_user,query_user_status,current_only_answerability,history_only_answerability,current_plus_history_answerability,current_plus_history_gain,evidence_scope_bucket,best_evidence_scope,best_current_evidence_summary,best_history_evidence_summary,best_current_plus_history_summary,reason,needs_user_check,current_only_top_score,history_only_top_score,current_plus_history_top_score,current_only_answer_coverage,history_only_answer_coverage,current_plus_history_answer_coverage,current_only_question_overlap,history_only_question_overlap,current_plus_history_question_overlap,current_only_answer_hits,history_only_answer_hits,current_plus_history_answer_hits,is_global_or_temporal,is_pure_global_statistical,current_pool_size,history_pool_size,current_plus_history_pool_size
1146,temporal_reasoning,comparison,"Which of the following happened first? A) Lucia joked with friends, making animal gestures by the projector, B) Shure walked with his girlfriend along the river by a bridge C) Alice discussed drying ideas with Jake and Tasha, D) Tasha discussed seating arrangements and headed toward the door, E) Jake chatted about penguin gifts, then went to the kitchen for food,",C,"[""A"", ""B"", ""C"", ""D"", ""E""]","{""DAY4_12513000_12520000"": [""ALICE""], ""DAY5_12300000_12303000"": [""LUCIA""], ""DAY5_15313000_15320000"": [""TASHA""], ""DAY5_20340000_20343000"": [""JAKE""], ""DAY7_13383000_13390000"": [""SHURE""]}",ok,4,46290.0,46320.0,12:51:30.00,12:52:00.00,Jake;Alice;Tasha;Lucia;Shure,"[{""day"": 4, ""end_time"": 46320.0, ""raw"": ""DAY4_12513000_12520000"", ""start_time"": 46290.0}, {""day"": 5, ""end_time"": 45030.0, ""raw"": ""DAY5_12300000_12303000"", ""start_time"": 45000.0}, {""day"": 5, ""end_time"": 55920.0, ""raw"": ""DAY5_15313000_15320000"", ""start_time"": 55890.0}, {""day"": 5, ""end_time"": 74070.0, ""raw"": ""DAY5_20340000_20343000"", ""start_time"": 74040.0}, {""day"": 7, ""end_time"": 49140.0, ""raw"": ""DAY7_13383000_13390000"", ""start_time"": 49110.0}]",UNKNOWN,unknown,partially_answerable,partially_answerable,partially_answerable,unclear_but_promising,tier_B_promising_history_gain,current_plus_historical,"[current_only rank=1 score=29.3204 source=Alice D5 20:34:00.00-20:34:30.00 30sec] at 20:34, I initially stood in the living room area on the first floor while Nicous, Choiszt, Jake, Katrina, and Jack gathered near the doorway. I heard snippets of their conversation, which included phrases like ""He gave my girlfriend a penguin,"" ""He gave... || [current_only rank=2 score=26.4656 source=Jake D5 20:34:00.00-20:34:30.00 30sec] I am in the living room with a group of friends, including Nicous, Katrina, Lucia, Tasha, and Alice. Nicous is speaking, relaying stories about a penguin gift, saying ""He gave my girlfriend a penguin,"" and ""He gave his ex-boyfriend a penguin,"" which prompts... || [current_only rank=3 score=25.8125 source=Lucia D5 12:31:00.00-12:31:30.00 30sec] Alright, here’s what happened: I started the video by doing a dog impression, saying ""Woof woof woof"" while projecting the shadow of a dog using my hands on the projector screen. Alice asked, ""Does it bite?"", prompting me to turn my head to my right to look...","[history_only rank=1 score=32.7653 source=Alice D2 11:37:30.00-11:38:00.00 30sec] My day began with a lively chat among friends. I was standing behind Lucia, power bank and phone in hand, listening to Tasha, Lucia, and Katrina as they discussed strategies for new user registration and joked about changing ""Nicous"" between cities. I overh... || [history_only rank=2 score=31.4719 source=Jake D3 12:20:00.00-12:30:00.00 10min] I started this ten-minute period by examining some data cables before wandering through what seemed like a living room and heading up the stairs to the second floor. I then came back down to a room where a group of us were gathered around a table. Alice, Lu... || [history_only rank=3 score=30.2891 source=Jake D4 11:50:00.00-12:00:00.00 10min] I started my day by walking out of the bedroom, and Alice immediately commented on her wilting peony. I jokingly asked if it could be ripened, triggering a humorous exchange with Lucia about rapid blooming and final exams. Moving on, I grabbed a pepper and...","[current_plus_historical rank=1 score=40.2708 source=Alice D5 20:34:00.00-20:34:30.00 30sec] at 20:34, I initially stood in the living room area on the first floor while Nicous, Choiszt, Jake, Katrina, and Jack gathered near the doorway. I heard snippets of their conversation, which included phrases like ""He gave my girlfriend a penguin,"" ""He gave... || [current_plus_historical rank=2 score=34.2117 source=Jake D5 20:34:00.00-20:34:30.00 30sec] I am in the living room with a group of friends, including Nicous, Katrina, Lucia, Tasha, and Alice. Nicous is speaking, relaying stories about a penguin gift, saying ""He gave my girlfriend a penguin,"" and ""He gave his ex-boyfriend a penguin,"" which prompts... || [current_plus_historical rank=3 score=32.7399 source=Alice D2 11:37:30.00-11:38:00.00 30sec] My day began with a lively chat among friends. I was standing behind Lucia, power bank and phone in hand, listening to Tasha, Lucia, and Katrina as they discussed strategies for new user registration and joked about changing ""Nicous"" between cities. I overh... || [current_plus_historical rank=4 score=31.4945 source=Jake D3 12:20:00.00-12:30:00.00 10min] I started this ten-minute period by examining some data cables before wandering through what seemed like a living room and heading up the stairs to the second floor. I then came back down to a room where a group of us were gathered around a table. Alice, Lu...","current=partially_answerable (question appears to require exhaustive temporal/count/order coverage; captions mention answer-related terms but top-k evidence cannot verify absence/order exhaustively; answer_hits=alice,and,discuss,dry,jake,tasha; coverage=0.86; q_overlap=34) | history=partially_answerable (question appears to require exhaustive temporal/count/order coverage; captions mention answer-related terms but top-k evidence cannot verify absence/order exhaustively; answer_hits=alice,and,discuss,ideas,jake,tasha; coverage=0.86; q_overlap=33) | current+history=partially_answerable (question appears to require exhaustive temporal/count/order coverage; captions mention answer-related terms but top-k evidence cannot verify absence/order exhaustively; answer_hits=alice,and,discuss,ideas,jake,tasha; coverage=0.86; q_overlap=33) | gain=unclear_but_promising | bucket=tier_B_promising_history_gain | global/statistical/temporal question handled conservatively | caption-only heuristic; not a final label and not answer accuracy",yes,29.3204,32.7653,40.2708,0.8571,0.8571,0.8571,34,33,33,alice;and;discuss;dry;jake;tasha,alice;and;discuss;ideas;jake;tasha,alice;and;discuss;ideas;jake;tasha,yes,no,251,13608,13834
1181,temporal_reasoning,comparison,"Which of the following happened last? A) Lucia finished dismantling a cabinet and sorted the parts B) Alice helped charge devices and wrapped up the gathering, C) Katrina led room redecorating plans and coordinated technical setup, D) Jake paid for Hema groceries to prepare for the barbecue, E) Tasha organized belongings, discussed chores, and prepared to rest,",A,"[""A"", ""B"", ""C"", ""D"", ""E""]","{""DAY2_11500000_12500000"": [""ALICE""], ""DAY2_21500000_22500000"": [""KATRINA""], ""DAY3_15400000_16400000"": [""JAKE""], ""DAY5_16500000_17000000"": [""TASHA""], ""DAY7_17300000_18300000"": [""LUCIA""]}",ok,2,42600.0,82200.0,11:50:00.00,22:50:00.00,Jake;Alice;Tasha;Lucia;Katrina,"[{""day"": 2, ""end_time"": 46200.0, ""raw"": ""DAY2_11500000_12500000"", ""start_time"": 42600.0}, {""day"": 2, ""end_time"": 82200.0, ""raw"": ""DAY2_21500000_22500000"", ""start_time"": 78600.0}, {""day"": 3, ""end_time"": 60000.0, ""raw"": ""DAY3_15400000_16400000"", ""start_time"": 56400.0}, {""day"": 5, ""end_time"": 61200.0, ""raw"": ""DAY5_16500000_17000000"", ""start_time"": 60600.0}, {""day"": 7, ""end_time"": 66600.0, ""raw"": ""DAY7_17300000_18300000"", ""start_time"": 63000.0}]",UNKNOWN,unknown,partially_answerable,partially_answerable,partially_answerable,unclear_but_promising,tier_B_promising_history_gain,current_plus_historical,"[current_only rank=1 score=24.0209 source=Lucia D7 18:20:00.00-18:30:00.00 10min] for the last ten minutes, I've been battling this white plastic object, maybe part of a cabinet or drawer system. I started out trying to pry it open with my hands, really worried about breaking it because it was so tight. I even tried using tweezers to get... || [current_only rank=2 score=23.1256 source=Jake D3 15:42:00.00-15:42:30.00 30sec] Alright, here's what's happening: I start off walking behind Tasha and Katrina as we're strolling down the sidewalk, then I navigate my way to the front of the group. Katrina mentions that there's a Hema Fresh nearby, specifically about 200 meters away at f... || [current_only rank=3 score=22.9379 source=Lucia D7 18:30:00.00-18:40:00.00 10min] it's Day 7, around 6:30 PM. I started the evening by unpacking and organizing parts; a task that involved fear associated with someone from the dissembly, I tried to put them into a storage box. After that, I cleaned up the trash, looked at a data cable, an...","[history_only rank=1 score=29.4223 source=Katrina D1 12:10:00.00-12:20:00.00 10min] I'm sitting at a table with Tasha, Lucia, Jake, Shure, Katrina, and later Alice, in a room with a checkered tablecloth and a whiteboard covered in notes, immersed in a lively discussion about food, logistics, and entertainment for an upcoming gathering. Ini... || [history_only rank=2 score=29.1062 source=Jake D1 11:10:00.00-11:20:00.00 10min] the meeting started with me having everyone mark their attendance on my phone. After that, we were figuring out what to do on our last day. I brought out a little tripod, thinking it might help with the discussion, but Shure suggested we look at some hard d... || [history_only rank=3 score=25.3528 source=Tasha D1 11:11:30.00-11:12:00.00 30sec] I see that others around the table are in the process of installing something. I reach out and pick up an object, and then proceed to take out other accessories from within its packaging. Shortly after, I change my mind and put the accessories back inside....","[current_plus_historical rank=1 score=29.9145 source=Katrina D1 12:10:00.00-12:20:00.00 10min] I'm sitting at a table with Tasha, Lucia, Jake, Shure, Katrina, and later Alice, in a room with a checkered tablecloth and a whiteboard covered in notes, immersed in a lively discussion about food, logistics, and entertainment for an upcoming gathering. Ini... || [current_plus_historical rank=2 score=29.7366 source=Jake D1 11:10:00.00-11:20:00.00 10min] the meeting started with me having everyone mark their attendance on my phone. After that, we were figuring out what to do on our last day. I brought out a little tripod, thinking it might help with the discussion, but Shure suggested we look at some hard d... || [current_plus_historical rank=3 score=26.4171 source=Tasha D1 11:11:30.00-11:12:00.00 30sec] I see that others around the table are in the process of installing something. I reach out and pick up an object, and then proceed to take out other accessories from within its packaging. Shortly after, I change my mind and put the accessories back inside.... || [current_plus_historical rank=4 score=25.0217 source=Tasha D1 12:00:00.00-12:10:00.00 10min] From 12:00:00 to 12:10:00, I was sitting at a table with Katrina, Shure, Jake, Lucia, Alice and Tasha, getting things organized. We started by talking about playing music outside and reminiscing about an earlier song. We discussed the vase and some flower a...","current=partially_answerable (question appears to require exhaustive temporal/count/order coverage; captions mention answer-related terms but top-k evidence cannot verify absence/order exhaustively; answer_hits=and,cabinet,dismantl,finish,lucia,parts,sort; coverage=1.00; q_overlap=30) | history=partially_answerable (question appears to require exhaustive temporal/count/order coverage; captions mention answer-related terms but top-k evidence cannot verify absence/order exhaustively; answer_hits=and,dismantl,lucia,parts,sort; coverage=0.71; q_overlap=33) | current+history=partially_answerable (question appears to require exhaustive temporal/count/order coverage; captions mention answer-related terms but top-k evidence cannot verify absence/order exhaustively; answer_hits=and,cabinet,dismantl,lucia,parts,sort; coverage=0.86; q_overlap=34) | gain=unclear_but_promising | bucket=tier_B_promising_history_gain | global/statistical/temporal question handled conservatively | caption-only heuristic; not a final label and not answer accuracy",yes,24.0209,29.4223,29.9145,1.0000,0.7143,0.8571,30,33,34,and;cabinet;dismantl;finish;lucia;parts;sort,and;dismantl;lucia;parts;sort,and;cabinet;dismantl;lucia;parts;sort,yes,no,2175,4840,6985
1219,temporal_reasoning,comparison,"Which of the following happened last? A) Alice grabs a slice of pizza and jokes with friends, B) Jake tells them to wait on snacking while on his phone, C) Katrina discusses checkout time as Shure arrives with a suitcase D) Tasha pours drinks and talks with Alice about gloves, E) Lucia's group rewound the video and resumed practicing the dance,",C,"[""A"", ""B"", ""C"", ""D"", ""E""]","{""DAY2_15380000_15383000"": [""LUCIA""], ""DAY2_21013000_21020000"": [""TASHA""], ""DAY6_21093000_21100000"": [""ALICE""], ""DAY7_13070000_13073000"": [""JAKE""], ""DAY7_17373000_17380000"": [""KATRINA""]}",ok,2,56280.0,75720.0,15:38:00.00,21:02:00.00,Jake;Alice;Tasha;Lucia;Katrina;Shure,"[{""day"": 2, ""end_time"": 56310.0, ""raw"": ""DAY2_15380000_15383000"", ""start_time"": 56280.0}, {""day"": 2, ""end_time"": 75720.0, ""raw"": ""DAY2_21013000_21020000"", ""start_time"": 75690.0}, {""day"": 6, ""end_time"": 76200.0, ""raw"": ""DAY6_21093000_21100000"", ""start_time"": 76170.0}, {""day"": 7, ""end_time"": 47250.0, ""raw"": ""DAY7_13070000_13073000"", ""start_time"": 47220.0}, {""day"": 7, ""end_time"": 63480.0, ""raw"": ""DAY7_17373000_17380000"", ""start_time"": 63450.0}]",UNKNOWN,unknown,partially_answerable,partially_answerable,partially_answerable,unclear_but_promising,tier_B_promising_history_gain,current_plus_historical,"[current_only rank=1 score=30.1195 source=Jake D7 13:07:00.00-13:07:30.00 30sec] I'm holding and operating my phone while listening to a conversation between Lucia, Jake, and Alice, initiated by Lucia's statement: ""If one happens and then the other, it's still happening at the same time."" Jake responds, ""Then just wait,"" and Alice chime... || [current_only rank=2 score=23.4202 source=Lucia D6 21:10:00.00-21:20:00.00 10min] I spent a good ten minutes outside with friends, the evening progressing with lots of easy conversation and shared moments. Initially, I was part of a group, observing Alice hand something to someone, and then I briefly whistled, keeping my eyes on the inte... || [current_only rank=3 score=22.7021 source=Katrina D2 15:30:00.00-15:40:00.00 10min] I started this segment by glancing down at my feet, before turning my attention to Alice as she walked over to the table to examine the flowers and a tablet that I'd ordered. Feeling a burst of energy, I launched into a brief dance, waving my arms and movin...","[history_only rank=1 score=27.2970 source=Jake D1 18:13:00.00-18:13:30.00 30sec] Alright, here's what's happening. I'm at the checkout area of what I believe is Hema, standing amidst a group of friends: Jake, Tasha, Alice and Lucia. We've been discussing coupons and the checkout process, specifically mentioning that at Hema, you need to... || [history_only rank=2 score=26.3264 source=Alice D2 11:58:00.00-11:58:30.00 30sec] The video begins with me holding my phone, initially showing a blank screen before opening the phone to reveal content that holds my interest. I hear Jake say, ""Oh right, it's this one."" Soon after, I am looking at what appears to be a video, and I hear Luc... || [history_only rank=3 score=25.2286 source=Katrina D1 12:10:00.00-12:20:00.00 10min] I'm sitting at a table with Tasha, Lucia, Jake, Shure, Katrina, and later Alice, in a room with a checkered tablecloth and a whiteboard covered in notes, immersed in a lively discussion about food, logistics, and entertainment for an upcoming gathering. Ini...","[current_plus_historical rank=1 score=31.7431 source=Jake D7 13:07:00.00-13:07:30.00 30sec] I'm holding and operating my phone while listening to a conversation between Lucia, Jake, and Alice, initiated by Lucia's statement: ""If one happens and then the other, it's still happening at the same time."" Jake responds, ""Then just wait,"" and Alice chime... || [current_plus_historical rank=2 score=27.2705 source=Jake D1 18:13:00.00-18:13:30.00 30sec] Alright, here's what's happening. I'm at the checkout area of what I believe is Hema, standing amidst a group of friends: Jake, Tasha, Alice and Lucia. We've been discussing coupons and the checkout process, specifically mentioning that at Hema, you need to... || [current_plus_historical rank=3 score=26.2971 source=Alice D2 11:58:00.00-11:58:30.00 30sec] The video begins with me holding my phone, initially showing a blank screen before opening the phone to reveal content that holds my interest. I hear Jake say, ""Oh right, it's this one."" Soon after, I am looking at what appears to be a video, and I hear Luc... || [current_plus_historical rank=4 score=25.4450 source=Lucia D6 21:10:00.00-21:20:00.00 10min] I spent a good ten minutes outside with friends, the evening progressing with lots of easy conversation and shared moments. Initially, I was part of a group, observing Alice hand something to someone, and then I briefly whistled, keeping my eyes on the inte...","current=partially_answerable (question appears to require exhaustive temporal/count/order coverage; captions mention answer-related terms but top-k evidence cannot verify absence/order exhaustively; answer_hits=arriv,as,discuss,katrina,shure; coverage=0.71; q_overlap=28) | history=partially_answerable (question appears to require exhaustive temporal/count/order coverage; captions mention answer-related terms but top-k evidence cannot verify absence/order exhaustively; answer_hits=arriv,as,checkout,discuss,katrina,shure; coverage=0.86; q_overlap=29) | current+history=partially_answerable (question appears to require exhaustive temporal/count/order coverage; captions mention answer-related terms but top-k evidence cannot verify absence/order exhaustively; answer_hits=arriv,as,checkout,discuss,katrina,shure; coverage=0.86; q_overlap=29) | gain=unclear_but_promising | bucket=tier_B_promising_history_gain | global/statistical/temporal question handled conservatively | caption-only heuristic; not a final label and not answer accuracy",yes,30.1195,27.2970,31.7431,0.7143,0.8571,0.8571,28,29,29,arriv;as;discuss;katrina;shure,arriv;as;checkout;discuss;katrina;shure,arriv;as;checkout;discuss;katrina;shure,yes,no,289,6376,6648
1186,temporal_reasoning,comparison,"Which is the correct sequence of events? A) Lucia helped finalize an Earth Day-themed coin-and-auction event plan, B) Alice guided park route decisions after checking the tourist map and discussing vending machine issues, C) Jake went shopping at a supermarket with a problematic cart and browsed beverages and housewares",A-B-C,"[""A-C-B"", ""C-A-B"", ""B-A-C"", ""A-B-C"", ""B-C-A""]","{""DAY1_11500000_12000000"": [""LUCIA""], ""DAY1_14100000_14200000"": [""TASHA""], ""DAY3_15100000_15200000"": [""ALICE""], ""DAY3_21300000_21400000"": [""KATRINA""], ""DAY5_15500000_16000000"": [""JAKE""]}",ok,1,42600.0,51600.0,11:50:00.00,14:20:00.00,Jake;Alice;Tasha;Lucia;Katrina,"[{""day"": 1, ""end_time"": 43200.0, ""raw"": ""DAY1_11500000_12000000"", ""start_time"": 42600.0}, {""day"": 1, ""end_time"": 51600.0, ""raw"": ""DAY1_14100000_14200000"", ""start_time"": 51000.0}, {""day"": 3, ""end_time"": 55200.0, ""raw"": ""DAY3_15100000_15200000"", ""start_time"": 54600.0}, {""day"": 3, ""end_time"": 78000.0, ""raw"": ""DAY3_21300000_21400000"", ""start_time"": 77400.0}, {""day"": 5, ""end_time"": 57600.0, ""raw"": ""DAY5_15500000_16000000"", ""start_time"": 57000.0}]",UNKNOWN,unknown,partially_answerable,unclear,partially_answerable,unclear_but_promising,tier_B_promising_history_gain,current_plus_historical,"[current_only rank=1 score=38.2462 source=Alice D3 15:16:30.00-15:17:00.00 30sec] the video begins with Lucia explaining, ""It's the place with the little star,"" indicating our destination. We arrive at ""this place,"" as Jake points out and Alice confirms, ""We are here."" I am standing with Jake and Lucia at a park map, and Jake is pointing... || [current_only rank=2 score=28.1633 source=Lucia D1 11:55:30.00-11:56:00.00 30sec] The video begins in a room where a small group of us – Jake, Katrina, Alice, Shure and I– are gathered around a table covered with a red and white checkered tablecloth. There are several items on the table, including a vase of pink and green flowers, a pair... || [current_only rank=3 score=27.0037 source=Katrina D1 11:40:00.00-11:50:00.00 10min] I'm sitting in a room with Lucy, Shure, Jake, Katrina, Tasha, and Alice, engaged in a collaborative planning session, which seems to revolve around an Earth Day-themed event. Initially, Lucy's describing the concept of making cardboard dogs of varying compl...","[history_only rank=1 score=26.5750 source=Katrina D1 11:40:00.00-11:50:00.00 10min] I'm sitting in a room with Lucy, Shure, Jake, Katrina, Tasha, and Alice, engaged in a collaborative planning session, which seems to revolve around an Earth Day-themed event. Initially, Lucy's describing the concept of making cardboard dogs of varying compl... || [history_only rank=2 score=21.2277 source=Jake D1 11:49:30.00-11:50:00.00 30sec] As Shure spoke, I rose from my seat, moving to the left and then forward. The sounds of the conversation faded as I approached the bedroom, eventually stepping inside. In the bedroom, I picked up a piece of paper, holding it in my left hand. I then put the... || [history_only rank=3 score=20.6798 source=Lucia D1 11:47:00.00-11:47:30.00 30sec] I am in a room with Jake, Alice, Tasha, Katrina, and Shure. Jake says ""or else clip it,"" and then Alice brushes her hair. Tasha then yawns. Katrina asks, ""Do we have a clip?"" Jake responds, ""Okay."" Shure says, ""And then,"" after which Alice begins explaining...","[current_plus_historical rank=1 score=41.7773 source=Alice D3 15:16:30.00-15:17:00.00 30sec] the video begins with Lucia explaining, ""It's the place with the little star,"" indicating our destination. We arrive at ""this place,"" as Jake points out and Alice confirms, ""We are here."" I am standing with Jake and Lucia at a park map, and Jake is pointing... || [current_plus_historical rank=2 score=28.8466 source=Alice D3 15:10:00.00-15:20:00.00 10min] On the third day of our Huashan trip, I began walking with my friends Shure, Jake, Tasha, Alice, Katrina, and Lucia. We followed a path, initially pausing at a stone bridge where I checked my phone, responding to messages and briefly chatting with them. Jak... || [current_plus_historical rank=3 score=28.5567 source=Lucia D1 11:55:30.00-11:56:00.00 30sec] The video begins in a room where a small group of us – Jake, Katrina, Alice, Shure and I– are gathered around a table covered with a red and white checkered tablecloth. There are several items on the table, including a vase of pink and green flowers, a pair... || [current_plus_historical rank=4 score=27.0626 source=Katrina D1 11:40:00.00-11:50:00.00 10min] I'm sitting in a room with Lucy, Shure, Jake, Katrina, Tasha, and Alice, engaged in a collaborative planning session, which seems to revolve around an Earth Day-themed event. Initially, Lucy's describing the concept of making cardboard dogs of varying compl...","current=partially_answerable (question appears to require exhaustive temporal/count/order coverage; captions mention answer-related terms but top-k evidence cannot verify absence/order exhaustively; answer_hits=alice,an,and,at,auction,brows,cart,check,coin,day,discuss,earth,event,jake,lucia,machine,map,park,plan,route,shopp,supermarket,tourist,vend,went; coverage=0.78; q_overlap=27) | history=unclear (global/statistical/temporal question with partial lexical overlap; caption coverage may be too local; answer_hits=alice,an,and,at,auction,check,day,discuss,earth,event,issu,jake,lucia,plan,went; coverage=0.47; q_overlap=19) | current+history=partially_answerable (question appears to require exhaustive temporal/count/order coverage; captions mention answer-related terms but top-k evidence cannot verify absence/order exhaustively; answer_hits=alice,an,and,at,auction,beverage,brows,cart,check,coin,day,discuss,earth,event,issu,jake,lucia,machine,map,park,plan,route,shopp,supermarket,tourist,vend,went; coverage=0.84; q_overlap=29) | gain=unclear_but_promising | bucket=tier_B_promising_history_gain | global/statistical/temporal question handled conservatively | caption-only heuristic; not a final label and not answer accuracy",yes,38.2462,26.5750,41.7773,0.7812,0.4688,0.8438,27,19,29,alice;an;and;at;auction;brows;cart;check;coin;day;discuss;earth;event;jake;lucia;machine;map;park;plan;route;shopp;supermarket;tourist;vend;went,alice;an;and;at;auction;check;day;discuss;earth;event;issu;jake;lucia;plan;went,alice;an;and;at;auction;beverage;brows;cart;check;coin;day;discuss;earth;event;issu;jake;lucia;machine;map;park;plan;route;shopp;supermarket;tourist;vend;went,yes,no,695,431,1096
