question_id,category,subcategory,question,answer,options_json,contexts_json,parse_status,context_day,context_start,context_end,context_start_hms,context_end_hms,agents_in_context,parsed_contexts_json,provisional_query_user,query_user_status,current_only_answerability,history_only_answerability,current_plus_history_answerability,current_plus_history_gain,evidence_scope_bucket,best_evidence_scope,best_current_evidence_summary,best_history_evidence_summary,best_current_plus_history_summary,reason,needs_user_check,current_only_top_score,history_only_top_score,current_plus_history_top_score,current_only_answer_coverage,history_only_answer_coverage,current_plus_history_answer_coverage,current_only_question_overlap,history_only_question_overlap,current_plus_history_question_overlap,current_only_answer_hits,history_only_answer_hits,current_plus_history_answer_hits,is_global_or_temporal,is_pure_global_statistical,current_pool_size,history_pool_size,current_plus_history_pool_size
1227,temporal_reasoning,comparison,"Which of the following happened first? A) Lucia and Jake aligned a drawer on a cabinet, B) Shure sang and played guitar, taking a brief phone call, C) Alice and friends arranged puzzle pieces together, D) Jake rode the elevator downstairs with Lucia and Jack, E) Tasha watched Shure bring a plate over amid joking",C,"[""A"", ""B"", ""C"", ""D"", ""E""]","{""DAY1_13160000_13163000"": [""ALICE""], ""DAY4_17213000_17220000"": [""LUCIA""], ""DAY4_18173000_18180000"": [""SHURE""], ""DAY5_16230000_16233000"": [""JAKE""], ""DAY7_12190000_12193000"": [""TASHA""]}",ok,1,47760.0,47790.0,13:16:00.00,13:16:30.00,Jake;Alice;Tasha;Lucia;Shure,"[{""day"": 1, ""end_time"": 47790.0, ""raw"": ""DAY1_13160000_13163000"", ""start_time"": 47760.0}, {""day"": 4, ""end_time"": 62520.0, ""raw"": ""DAY4_17213000_17220000"", ""start_time"": 62490.0}, {""day"": 4, ""end_time"": 65880.0, ""raw"": ""DAY4_18173000_18180000"", ""start_time"": 65850.0}, {""day"": 5, ""end_time"": 59010.0, ""raw"": ""DAY5_16230000_16233000"", ""start_time"": 58980.0}, {""day"": 7, ""end_time"": 44370.0, ""raw"": ""DAY7_12190000_12193000"", ""start_time"": 44340.0}]",UNKNOWN,unknown,partially_answerable,partially_answerable,partially_answerable,unclear_but_promising,tier_B_promising_history_gain,current_plus_historical,"[current_only rank=1 score=31.1405 source=Jake D4 17:10:00.00-17:20:00.00 10min] I started out on the patio with Shure, who was playing guitar, and a couple of other people. After taking a good look around outside, I went inside and started messing around with my phone, checking alarms and timers. Then, I went back in the room with the... || [current_only rank=2 score=26.9556 source=Lucia D4 17:10:00.00-17:20:00.00 10min] I started out trying to put together this white cabinet, basically a set of drawers. I was struggling with the assembly right from the start, pressing on the lid and trying to get the bottom drawer in, exclaiming ""Oh boy"" when I finally suppressed the drawe... || [current_only rank=3 score=26.2510 source=Jake D4 17:20:00.00-17:30:00.00 10min] from 17:20:00 to 17:30:00, the majority of the time was spent assembling and debugging a white storage unit, or possibly a drawer. Initially, I was trying to figure out how a rectangular piece fit, getting input from Lucia. At one point, Tasha was nearby, a...","[history_only rank=1 score=25.0816 source=Jake D1 12:30:00.00-12:40:00.00 10min] I started off this 10-minute stretch by initially commenting that someone was getting anxious while standing over a puzzle and people at the table. I picked up a puzzle piece and manipulated it for a while. Lucia made a comment that the area might be the sa... || [history_only rank=2 score=23.0112 source=Alice D1 13:08:00.00-13:08:30.00 30sec] the video begins with Shure instructing Tasha to position a puzzle piece ""a little higher."" Together, Tasha and I begin working on a wooden puzzle, placing individual pieces onto a circular plate on the table, making constant adjustments to their positions.... || [history_only rank=3 score=22.5222 source=Alice D1 13:01:30.00-13:02:00.00 30sec] Okay, the video starts with Shure saying ""How did it suddenly turn into network Arrow?"" as I slowly adjust my position at the table, constantly shifting to get a better view of the puzzle. Then Jake says, ""Okay, let me see"" and I think to myself that I want...","[current_plus_historical rank=1 score=33.1665 source=Jake D4 17:10:00.00-17:20:00.00 10min] I started out on the patio with Shure, who was playing guitar, and a couple of other people. After taking a good look around outside, I went inside and started messing around with my phone, checking alarms and timers. Then, I went back in the room with the... || [current_plus_historical rank=2 score=31.8558 source=Lucia D4 17:10:00.00-17:20:00.00 10min] I started out trying to put together this white cabinet, basically a set of drawers. I was struggling with the assembly right from the start, pressing on the lid and trying to get the bottom drawer in, exclaiming ""Oh boy"" when I finally suppressed the drawe... || [current_plus_historical rank=3 score=28.5217 source=Jake D4 17:20:00.00-17:30:00.00 10min] from 17:20:00 to 17:30:00, the majority of the time was spent assembling and debugging a white storage unit, or possibly a drawer. Initially, I was trying to figure out how a rectangular piece fit, getting input from Lucia. At one point, Tasha was nearby, a... || [current_plus_historical rank=4 score=27.7249 source=Lucia D5 16:20:00.00-16:30:00.00 10min] I'm at a grocery store on Day 5 with Shure, Nicous, Jake, Choiszt, Katrina, Tasha and Jack, and we're trying to figure out the shopping list for our guests and some kind of show we're working on. At first, we're gathered around a cart, examining the items a...","current=partially_answerable (question appears to require exhaustive temporal/count/order coverage; captions mention answer-related terms but top-k evidence cannot verify absence/order exhaustively; answer_hits=alice,and,friend,piece,puzzle,together; coverage=0.86; q_overlap=31) | history=partially_answerable (question appears to require exhaustive temporal/count/order coverage; captions mention answer-related terms but top-k evidence cannot verify absence/order exhaustively; answer_hits=alice,and,arrang,friend,piece,puzzle,together; coverage=1.00; q_overlap=26) | current+history=partially_answerable (question appears to require exhaustive temporal/count/order coverage; captions mention answer-related terms but top-k evidence cannot verify absence/order exhaustively; answer_hits=alice,and,arrang,friend,piece,puzzle,together; coverage=1.00; q_overlap=32) | gain=unclear_but_promising | bucket=tier_B_promising_history_gain | global/statistical/temporal question handled conservatively | caption-only heuristic; not a final label and not answer accuracy",yes,31.1405,25.0816,33.1665,0.8571,1.0000,1.0000,31,26,32,alice;and;friend;piece;puzzle;together,alice;and;arrang;friend;piece;puzzle;together,alice;and;arrang;friend;piece;puzzle;together,yes,no,276,1322,1573
1231,temporal_reasoning,comparison,"Which of the following happened last? A) Lucia discussed owed wages and red envelopes with the group B) Alice decided to use charcoal due to scarce kindling, C) Tasha observed the gift selection and typed on her phone, D) Shure set up a coffee maker, placing filter paper, E) Jake watched a rehearsal and applauded after the song,",A,"[""A"", ""B"", ""C"", ""D"", ""E""]","{""DAY3_12313000_12320000"": [""TASHA""], ""DAY3_20133000_20140000"": [""ALICE""], ""DAY5_11330000_11333000"": [""SHURE""], ""DAY6_20313000_20320000"": [""JAKE""], ""DAY7_17450000_17453000"": [""LUCIA""]}",ok,3,45090.0,72840.0,12:31:30.00,20:14:00.00,Jake;Alice;Tasha;Lucia;Shure,"[{""day"": 3, ""end_time"": 45120.0, ""raw"": ""DAY3_12313000_12320000"", ""start_time"": 45090.0}, {""day"": 3, ""end_time"": 72840.0, ""raw"": ""DAY3_20133000_20140000"", ""start_time"": 72810.0}, {""day"": 5, ""end_time"": 41610.0, ""raw"": ""DAY5_11330000_11333000"", ""start_time"": 41580.0}, {""day"": 6, ""end_time"": 73920.0, ""raw"": ""DAY6_20313000_20320000"", ""start_time"": 73890.0}, {""day"": 7, ""end_time"": 63930.0, ""raw"": ""DAY7_17450000_17453000"", ""start_time"": 63900.0}]",UNKNOWN,unknown,partially_answerable,partially_answerable,partially_answerable,unclear_but_promising,tier_B_promising_history_gain,current_plus_historical,"[current_only rank=1 score=28.7148 source=Tasha D7 17:45:00.00-17:45:30.00 30sec] I filmed as Shure was walking back and forth while discussing the number of days wages owed with Katrina and Jake, with Katrina mentioning ""Including today..."" and Jake confirming ""Yeah, 4 days owed"" and specified ""4 days' wages owed."" Jake sat down next to... || [current_only rank=2 score=27.1403 source=Lucia D7 17:40:00.00-17:50:00.00 10min] After Shure told me ""Shure: 22.57,"" and Tasha said ""Tasha: Got it,"" I went to get a piece of paper from the table where everyone had been eating watermelon. The table had a red and white checkered tablecloth, and there were watermelon slices everywhere. I s... || [current_only rank=3 score=26.0963 source=Shure D5 11:33:00.00-11:33:30.00 30sec] The video begins as I enter the kitchen area and place something, obscured from clear view, onto the counter. I then proceed to set the coffee machine onto the available surface, positioning it for brewing. I subtly adjust surrounding items, shifting them i...","[history_only rank=1 score=27.4720 source=Shure D1 13:33:30.00-13:34:00.00 30sec] The video begins with me, Shure, observing the yard outside and then shifting my focus inside the kitchen area. I overhear Jake instructing about setting things up on the first floor and then up here. Jake asks if the table with desserts is also over here.... || [history_only rank=2 score=25.1775 source=Shure D1 13:30:00.00-13:40:00.00 10min] starting from looking at Katrina's phone and noticing messages about alcohol and drinks, I was part of a conversation about getting vodka and takeout, even looking in the refrigerator for ice, although I commented that it might be easier to just buy it. I p... || [history_only rank=3 score=25.1475 source=Alice D3 12:20:00.00-12:30:00.00 10min] I was sitting at this large table with the orange floral tablecloth, chatting with everyone - Alice, Lucia, Shure, Violet, and Katrina. Shure was playing with a toy and talking about sesame paste recipes, which had us all laughing. Lucia was searching for t...","[current_plus_historical rank=1 score=45.0977 source=Tasha D7 17:45:00.00-17:45:30.00 30sec] I filmed as Shure was walking back and forth while discussing the number of days wages owed with Katrina and Jake, with Katrina mentioning ""Including today..."" and Jake confirming ""Yeah, 4 days owed"" and specified ""4 days' wages owed."" Jake sat down next to... || [current_plus_historical rank=2 score=35.6823 source=Tasha D7 17:40:00.00-17:50:00.00 10min] Alright, so things started with me inputting numbers into my phone's calculator based on Shure's instructions while everyone laughed in the background. After adding ""94,"" ""22.57,"" ""40.8,"" ""96,"" and finally ""49.52,"" the total was 442.69, and I showed it to J... || [current_plus_historical rank=3 score=35.1456 source=Lucia D7 17:40:00.00-17:50:00.00 10min] After Shure told me ""Shure: 22.57,"" and Tasha said ""Tasha: Got it,"" I went to get a piece of paper from the table where everyone had been eating watermelon. The table had a red and white checkered tablecloth, and there were watermelon slices everywhere. I s... || [current_plus_historical rank=4 score=34.3031 source=Jake D7 17:45:00.00-17:45:30.00 30sec] I am participating in a group conversation about owed salaries and red envelopes, specifically referring to WeChat red envelopes, which I am accessing on my phone. The conversation begins with Katrina mentioning, ""Including today"" to which Jake responds wit...","current=partially_answerable (question appears to require exhaustive temporal/count/order coverage; captions mention answer-related terms but top-k evidence cannot verify absence/order exhaustively; answer_hits=and,discuss,envelop,group,lucia,owed,red,wages; coverage=1.00; q_overlap=27) | history=partially_answerable (question appears to require exhaustive temporal/count/order coverage; captions mention answer-related terms but top-k evidence cannot verify absence/order exhaustively; answer_hits=and,discuss,group,lucia,red; coverage=0.62; q_overlap=28) | current+history=partially_answerable (question appears to require exhaustive temporal/count/order coverage; captions mention answer-related terms but top-k evidence cannot verify absence/order exhaustively; answer_hits=and,discuss,envelop,group,lucia,owed,red,wages; coverage=1.00; q_overlap=29) | gain=unclear_but_promising | bucket=tier_B_promising_history_gain | global/statistical/temporal question handled conservatively | caption-only heuristic; not a final label and not answer accuracy",yes,28.7148,27.4720,45.0977,1.0000,0.6250,1.0000,27,28,29,and;discuss;envelop;group;lucia;owed;red;wages,and;discuss;group;lucia;red,and;discuss;envelop;group;lucia;owed;red;wages,yes,no,264,8726,8960
1233,temporal_reasoning,comparison,"Which of the following happened first? A) Jake rode in a fast car searching for the destination, B) Lucia sorted boxes, keeping the nicer, harder ones, C) Tasha joined a discussion about recording devices and copyright limits, D) Katrina packed materials, set an alarm, and prepared to leave E) Alice walked with friends discussing their picnic plans and pizzas,",B,"[""A"", ""B"", ""C"", ""D"", ""E""]","{""DAY1_14050000_14053000"": [""LUCIA""], ""DAY1_18190000_18193000"": [""TASHA""], ""DAY3_15313000_15320000"": [""ALICE""], ""DAY3_18033000_18040000"": [""JAKE""], ""DAY4_16223000_16230000"": [""KATRINA""]}",ok,1,50700.0,65970.0,14:05:00.00,18:19:30.00,Jake;Alice;Tasha;Lucia;Katrina,"[{""day"": 1, ""end_time"": 50730.0, ""raw"": ""DAY1_14050000_14053000"", ""start_time"": 50700.0}, {""day"": 1, ""end_time"": 65970.0, ""raw"": ""DAY1_18190000_18193000"", ""start_time"": 65940.0}, {""day"": 3, ""end_time"": 55920.0, ""raw"": ""DAY3_15313000_15320000"", ""start_time"": 55890.0}, {""day"": 3, ""end_time"": 65040.0, ""raw"": ""DAY3_18033000_18040000"", ""start_time"": 65010.0}, {""day"": 4, ""end_time"": 58980.0, ""raw"": ""DAY4_16223000_16230000"", ""start_time"": 58950.0}]",UNKNOWN,unknown,partially_answerable,partially_answerable,partially_answerable,unclear_but_promising,tier_B_promising_history_gain,current_plus_historical,"[current_only rank=1 score=32.9503 source=Lucia D1 14:05:00.00-14:05:30.00 30sec] I am currently at the door, looking through cardboard boxes. Shure is standing and looking at me while I go through the boxes, and she says, ""Lucia: Put away those softer"" ""Lucia: and ugly boxes,"" and continues, ""Lucia: We can just throw them away"" ""Lucia:... || [current_only rank=2 score=30.5600 source=Lucia D1 14:00:00.00-14:10:00.00 10min] I started out in the kitchen, hearing Shure say the house was really Chinese-style and overhearing a conversation about whether or not to make pasta, with Jake suggesting we shouldn't because of the house's style, and Lucia suggesting hot pot. Later, I was... || [current_only rank=3 score=20.0818 source=Katrina D3 15:31:30.00-15:32:00.00 30sec] I am walking forward, holding onto my shirt. I hear Katrina say, ""Pretty much,"" and Shure respond with, ""Yeah. Our picnic."" Katrina then says, ""I can only make rough plans. When I go out with my friends, it's like...Everyone lists one place they really want...","[history_only rank=1 score=26.3994 source=Jake D1 13:56:00.00-13:56:30.00 30sec] The video begins with me seated, engaged in a conversation about cardboard boxes. Lucia asks, ""Should we keep this carton, just in case we..."" and Jake responds, ""Keep it, keep it, yeah."" I glance to my right, then to my left, before opening a bag situated... || [history_only rank=2 score=26.0278 source=Tasha D1 12:10:00.00-12:20:00.00 10min] I'm at a meeting, centered around a table with a red and white checkered tablecloth. The entire ten-minute segment bounces between planning an event, specifically the food, the schedule, and prizes, while also showing me engrossed in my phone and occasional... || [history_only rank=3 score=24.0813 source=Katrina D1 12:10:00.00-12:20:00.00 10min] I'm sitting at a table with Tasha, Lucia, Jake, Shure, Katrina, and later Alice, in a room with a checkered tablecloth and a whiteboard covered in notes, immersed in a lively discussion about food, logistics, and entertainment for an upcoming gathering. Ini...","[current_plus_historical rank=1 score=39.1457 source=Lucia D1 14:05:00.00-14:05:30.00 30sec] I am currently at the door, looking through cardboard boxes. Shure is standing and looking at me while I go through the boxes, and she says, ""Lucia: Put away those softer"" ""Lucia: and ugly boxes,"" and continues, ""Lucia: We can just throw them away"" ""Lucia:... || [current_plus_historical rank=2 score=33.8055 source=Lucia D1 14:00:00.00-14:10:00.00 10min] I started out in the kitchen, hearing Shure say the house was really Chinese-style and overhearing a conversation about whether or not to make pasta, with Jake suggesting we shouldn't because of the house's style, and Lucia suggesting hot pot. Later, I was... || [current_plus_historical rank=3 score=25.9039 source=Jake D1 13:56:00.00-13:56:30.00 30sec] The video begins with me seated, engaged in a conversation about cardboard boxes. Lucia asks, ""Should we keep this carton, just in case we..."" and Jake responds, ""Keep it, keep it, yeah."" I glance to my right, then to my left, before opening a bag situated... || [current_plus_historical rank=4 score=25.7021 source=Tasha D1 12:10:00.00-12:20:00.00 10min] I'm at a meeting, centered around a table with a red and white checkered tablecloth. The entire ten-minute segment bounces between planning an event, specifically the food, the schedule, and prizes, while also showing me engrossed in my phone and occasional...","current=partially_answerable (question appears to require exhaustive temporal/count/order coverage; captions mention answer-related terms but top-k evidence cannot verify absence/order exhaustively; answer_hits=boxes,harder,keep,lucia,nicer,ones,sort; coverage=1.00; q_overlap=35) | history=partially_answerable (question appears to require exhaustive temporal/count/order coverage; captions mention answer-related terms but top-k evidence cannot verify absence/order exhaustively; answer_hits=boxes,keep,lucia,ones,sort; coverage=0.71; q_overlap=30) | current+history=partially_answerable (question appears to require exhaustive temporal/count/order coverage; captions mention answer-related terms but top-k evidence cannot verify absence/order exhaustively; answer_hits=boxes,harder,keep,lucia,nicer,ones,sort; coverage=1.00; q_overlap=37) | gain=unclear_but_promising | bucket=tier_B_promising_history_gain | global/statistical/temporal question handled conservatively | caption-only heuristic; not a final label and not answer accuracy",yes,32.9503,26.3994,39.1457,1.0000,0.7143,1.0000,35,30,37,boxes;harder;keep;lucia;nicer;ones;sort,boxes;keep;lucia;ones;sort,boxes;harder;keep;lucia;nicer;ones;sort,yes,no,282,1781,2043
1237,temporal_reasoning,comparison,"Which of the following happened first? A) Lucia adjusted her outfit and headed downstairs singing, B) Tasha went downstairs and checked the fridge for drinks, C) Alice chatted while the group browsed a tablet, D) Jake joked about improving memory and logic skills, E) Katrina sipped milk while discussing a call from Singapore",B,"[""A"", ""B"", ""C"", ""D"", ""E""]","{""DAY1_20430000_20433000"": [""TASHA""], ""DAY2_11513000_11520000"": [""ALICE""], ""DAY5_18100000_18103000"": [""LUCIA""], ""DAY5_19363000_19370000"": [""JAKE""], ""DAY6_10123000_10130000"": [""KATRINA""]}",ok,1,74580.0,74610.0,20:43:00.00,20:43:30.00,Jake;Alice;Tasha;Lucia;Katrina,"[{""day"": 1, ""end_time"": 74610.0, ""raw"": ""DAY1_20430000_20433000"", ""start_time"": 74580.0}, {""day"": 2, ""end_time"": 42720.0, ""raw"": ""DAY2_11513000_11520000"", ""start_time"": 42690.0}, {""day"": 5, ""end_time"": 65430.0, ""raw"": ""DAY5_18100000_18103000"", ""start_time"": 65400.0}, {""day"": 5, ""end_time"": 70620.0, ""raw"": ""DAY5_19363000_19370000"", ""start_time"": 70590.0}, {""day"": 6, ""end_time"": 36780.0, ""raw"": ""DAY6_10123000_10130000"", ""start_time"": 36750.0}]",UNKNOWN,unknown,partially_answerable,partially_answerable,partially_answerable,unclear_but_promising,tier_B_promising_history_gain,current_plus_historical,"[current_only rank=1 score=30.9923 source=Tasha D1 20:40:00.00-20:50:00.00 10min] we were trying to figure out where to eat – downstairs or upstairs. Lucia thought there was more food downstairs, so we were moving stuff up. I remember grabbing a bowl of soup, Alice telling me to take it, and Jake saying he'd bring something up first. Bac... || [current_only rank=2 score=24.3243 source=Tasha D6 10:10:00.00-10:20:00.00 10min] On Day 6, around 10:10 AM, I found myself in the kitchen, which was a bit cluttered with boxes and other items. There was a clear view of the outside patio from the window above the counter. As I walked around, I grabbed a cup, checked my phone after overhe... || [current_only rank=3 score=22.5669 source=Katrina D6 10:10:00.00-10:20:00.00 10min] I started my morning with a groggy stumble from my workspace, grabbing my glasses and phone before heading downstairs. In the living room, I saw someone already up and about, and made my way to the kitchen, overhearing a conversation between Jake and someon...","[history_only rank=1 score=28.0076 source=Katrina D1 19:10:00.00-19:20:00.00 10min] I started off looking for a pen, disrupting Tasha in the process, and found out Jake had taken it upstairs. Then, the focus shifted to water, with Lucia wanting to know which bottle was hers and complaining about the lack of unopened ones. Eventually, I hel... || [history_only rank=2 score=27.1235 source=Katrina D1 19:50:00.00-20:00:00.00 10min] I started in the kitchen, filling the kettle with water, noticing it had no water level. Then, I left the kitchen and noticed Alice was cleaning ingredients near the trash can, so I put the kettle on the cluttered table outside. I overheard Lucia and Tasha... || [history_only rank=3 score=23.5672 source=Tasha D1 17:20:00.00-17:30:00.00 10min] we were at the supermarket, and it started with the group, Alice, Jake, Lucia, Shure, Katrina, Tasha, and me trying to figure out the shopping plan. People had different food preferences, like with the unnamed food. Shure suggested we split up, which led to...","[current_plus_historical rank=1 score=32.4068 source=Tasha D1 20:40:00.00-20:50:00.00 10min] we were trying to figure out where to eat – downstairs or upstairs. Lucia thought there was more food downstairs, so we were moving stuff up. I remember grabbing a bowl of soup, Alice telling me to take it, and Jake saying he'd bring something up first. Bac... || [current_plus_historical rank=2 score=27.9031 source=Katrina D1 19:10:00.00-19:20:00.00 10min] I started off looking for a pen, disrupting Tasha in the process, and found out Jake had taken it upstairs. Then, the focus shifted to water, with Lucia wanting to know which bottle was hers and complaining about the lack of unopened ones. Eventually, I hel... || [current_plus_historical rank=3 score=26.9538 source=Katrina D1 19:50:00.00-20:00:00.00 10min] I started in the kitchen, filling the kettle with water, noticing it had no water level. Then, I left the kitchen and noticed Alice was cleaning ingredients near the trash can, so I put the kettle on the cluttered table outside. I overheard Lucia and Tasha... || [current_plus_historical rank=4 score=26.7835 source=Tasha D6 10:10:00.00-10:20:00.00 10min] On Day 6, around 10:10 AM, I found myself in the kitchen, which was a bit cluttered with boxes and other items. There was a clear view of the outside patio from the window above the counter. As I walked around, I grabbed a cup, checked my phone after overhe...","current=partially_answerable (question appears to require exhaustive temporal/count/order coverage; captions mention answer-related terms but top-k evidence cannot verify absence/order exhaustively; answer_hits=and,check,downstair,drink,for,fridge,tasha,went; coverage=1.00; q_overlap=28) | history=partially_answerable (question appears to require exhaustive temporal/count/order coverage; captions mention answer-related terms but top-k evidence cannot verify absence/order exhaustively; answer_hits=and,check,downstair,drink,for,fridge,tasha,went; coverage=1.00; q_overlap=28) | current+history=partially_answerable (question appears to require exhaustive temporal/count/order coverage; captions mention answer-related terms but top-k evidence cannot verify absence/order exhaustively; answer_hits=and,check,downstair,drink,for,fridge,tasha,went; coverage=1.00; q_overlap=30) | gain=unclear_but_promising | bucket=tier_B_promising_history_gain | global/statistical/temporal question handled conservatively | caption-only heuristic; not a final label and not answer accuracy",yes,30.9923,28.0076,32.4068,1.0000,1.0000,1.0000,28,28,30,and;check;downstair;drink;for;fridge;tasha;went,and;check;downstair;drink;for;fridge;tasha;went,and;check;downstair;drink;for;fridge;tasha;went,yes,no,257,3881,4122
