qa_packet_id,source_case_id,question_id,evidence_scope,question,answer,category,provisional_query_user,query_user_status,evidence_text,evidence_sources,evidence_time_windows,evidence_modes,expected_use,auto_answerability_draft,auto_answerability_reason,needs_user_check
ESQP_CUR_001,HISTV1_001,1402,current_only,Who used the cabinet the most before 1PM on DAY4?,Shure,environmental_interaction,UNKNOWN,unknown,"[all_agents_current rank=1 score=6.7647 source=Shure D4 11:25:00.00-11:25:30.00] I started by picking up a spatula and proceeded to place slices of bread together in a pan that was on the stovetop. Subsequently, I placed chopsticks into a nearby bowl, temporarily setting them aside. Switching hands, I then used the spatula with my other hand, pressing down on the bread slices in the pan. I pressed the bread slice with the spatula twice. Next, I used the spatula to flip one of the slices of bread over in the pan. I placed the spatula again on top of the bread slices to press it. After that, I briefly turned to my left, catching sight of Lucia, and I briefly adjusted my glasses. I turned left again. Following this, I walked forward a short distance, before returning to the stove. Once back at the stove, I picked up the spatula again and grabbed the handle of the pot. I pressed the bread slices again. Finally, I used the spatula to lift the slice of bread before flipping it over in the pan.
[all_agents_current rank=2 score=6.6598 source=Shure D4 11:07:30.00-11:08:00.00] The video begins with me looking at the eggs cooking in a pan, noticing they might be slightly burnt. I hear Shure say ""Oh"" and then Alice asks, ""Oh, are you adding salt?"". I turn my head to look at them, then reply with, ""I didn't, but dipping in soy sauce works too,"" while glancing towards Katrina. I then walk over towards Katrina, before turning my head back in Alice's direction. Alice then says ""We don't have soy sauce,"" leading me to look back at her and respond, ""We resupplied this morning."" My gaze then shifts towards the living room area for a moment, before returning to focus on Alice. I then pick up a spatula and begin gathering the cooked eggs from the pan. Katrina's voice is heard asking, ""Did you finish the little cakes last night?"". I proceed to use the spatula to serve the eggs onto a plate. Katrina repeats her question, ""Hmm, did you finish the little cakes last night?"". Alice answers, ""No, there's still some left."" I scoop up another portion of the eggs as Katrina asks, ""Where did you put them, in the fridge?"". A small portion of the eggs falls off the spatula while I'm scooping, and Katrina makes a noise, ""Hmm hmm."" I respond with ""Haha"" after the egg falls. I then continue the process of scooping the remaining eggs onto the plate, repeating this action until most of the eggs have been transferred.
[all_agents_current rank=3 score=6.6475 source=Shure D4 11:04:30.00-11:05:00.00] The video begins with me near the kitchen sink, looking for a spatula. I say, ""So there's really no spatula?"". Disappointed, I raise my head up, then say ""Damn."" I stand up straight and close the cabinet door that I was just looking in. I then proceed to open another cabinet door to the left of the sink to look inside. Alice then chimes in, ""Can't believe there's no spatula"", to which I reply with ""Awesome"". I open the cabinet door again on the right side, I turned my head towards the living room. I adjust my glasses. I then greet Katrina by saying, ""Good morning."" I then turn my head to look at Alice, who is in the kitchen with me. I walk forward to stand next to Alice. I laugh, saying, ""Hahaha."" Katrina asks, ""What are you doing?"" and Alice replies, ""Ah, it's tough.""
[all_agents_current rank=4 score=6.1741 source=Shure D4 11:03:30.00-11:04:00.00] I am focusing on the eggs cooking on the stove to my right, situated in a pan next to a pot. I then pivot my head to the left, observing Alice, who is standing near the window and holding several items. I turn my head further to the left, glancing towards the living room area. Subsequently, I make a turn, re-orienting myself within the space, and walk behind Alice again. I watch Alice expertly handle a pan. After she puts her hands down, she moves toward the edge of the pool area. I lower my head and proceed to open a cabinet located beneath the counter. I reach inside and retrieve a pair of chopsticks, which I then inspect in my hand. I then close the cabinet door using my foot. A voice, presumably mine or someone nearby, says, ""Shure: I'll brush it out first.""
[all_agents_current rank=5 score=6.1510 source=Jake D4 11:14:00.00-11:14:30.00] I began by operating the laptop, starting with double-tapping the touchpad, followed by observing the content displayed on the screen. I then became aware of a conversation occurring outside of my immediate vicinity. Consequently, I leaned back momentarily before refocusing my attention on the computer, leaning forward to resume operation. I then used the touchpad again to slide and click. I straightened my posture before returning to a reclined position in order to continue interacting with the computer.",all_agents_current:Shure; all_agents_current:Jake,Shure D4 11:25:00.00-11:25:30.00; Shure D4 11:07:30.00-11:08:00.00; Shure D4 11:04:30.00-11:05:00.00; Shure D4 11:03:30.00-11:04:00.00; Jake D4 11:14:00.00-11:14:30.00,all_agents_current,diagnose whether current context captions alone cover the answer evidence,unclear,global/statistical/temporal question with partial lexical overlap; caption coverage may be too local; answer_hits=shure; answer_coverage=1.00; question_overlap=2,yes
ESQP_CUR_002,HISTV1_002,1527,current_only,Who used the mirror the most after 6PM on DAY4?,Shure,environmental_interaction,UNKNOWN,unknown,"[all_agents_current rank=1 score=8.2110 source=Shure D4 18:29:00.00-18:29:30.00] I begin by adjusting my glasses, after which I hear Jake state, ""I purposely opened my eyes wide."" I proceed to walk towards the kitchen area, eventually reaching the stove. I then turn to my left, and I hear Lucia say, ""Hmm,"" followed by, ""Because it's hard to draft,"" and Jake adds, ""And big eyes."" I take a bite of a roasted sweet potato, and Jake interjects with ""Oh."" I walk forward, and Lucia suggests, ""So just use that expression,"" while Alice walks back towards his room. I turn to my right and hear Lucia say, ""Emoji mode,"" as she continues speaking. Having finished the sweet potato, I walk towards a mirror, pausing to look at myself. Jake then says, ""He can't,"" and I adjust my glasses once again. I turn left after that, and Jake adds, ""You need to give him the lyrics."" I look in Jake's direction, then continue walking forward, and Tasha remarks, ""Teacher Yang needs you the most right now."" I walk towards Jake's computer, squat down, and shuffle a bit. Finally, I swipe the touchpad and begin operating his computer.
[all_agents_current rank=2 score=8.0628 source=Lucia D4 18:15:30.00-18:16:00.00] Alright, in this video, I'm sitting at a table with a red and white checkered tablecloth. I start by stating, ""I finally remembered to shave. To shave my beard. I drew one."" I'm referencing a cardboard cutout in the shape of an animal's head, perhaps a dog or a cat, and I use a white marker to draw on the cardboard. Someone off-camera, Tasha, responds, ""Huh?"" and ""Remembered what?"" and eventually, ""Wow."" I draw a round circle on the cardboard. Tasha then says, ""There's a task that needs you the most later."" Following this, I tear a piece of paper, prompting me to ask, ""What is it?"" I continue tearing the paper, discarding most of it but keeping a larger piece, and then I venture guesses like, ""Beating eggs? Whipping cream?"" Tasha replies, ""Kneading dough."" I then guess, ""Noodles."" I tear a small corner from the bottom of the remaining piece of paper and place it back on top. Tasha says, ""As long as you find it fun."" I then say ""We need to... Xiaobei... Really? Floss roll cake... Or... What's the dough for?"" While all of this is happening, I have a phone propped up on the table next to the cardboard, displaying a screen with various animal images, likely used as a reference for my drawing. The table is cluttered with various items including bottles, containers, and other crafting materials, suggesting a creative project is underway.
[all_agents_current rank=3 score=7.9275 source=Tasha D4 18:42:30.00-18:43:00.00] I was initially watching a video of my friend's life, labeled ""DAY4"" and attributed to ""A3_TASHA."" I then exited the video, scrolled down, and subsequently quit WeChat. Following this, I opened Douyin and commenced browsing through its content. While watching a video on Douyin, which included background music, I chose to pause the video to halt its playback.
[all_agents_current rank=4 score=7.5294 source=Alice D4 22:24:30.00-22:25:00.00] Alright, here's what's happening. The video starts with me holding my iPhone in my hands. The screen is displaying a ""You're All Set"" message with three green checkmarks. I then tap on the screen to proceed, and it transitions to a screen showing the details of the video, including video resolution, audio, GPS, and battery percentage. After a short period of viewing the details, I then tap ""Complete Recording."" In the background, I can see that I'm sitting with a few people in a room, one person is sitting on the floor against a wall with a checkerboard and another is wearing multicolored slides and standing, and another person is in a beige chair and their legs are visible. The day is ""DAY4"", and I am ""A2_ALICE"".
[all_agents_current rank=5 score=7.3508 source=Lucia D4 18:33:30.00-18:34:00.00] I bent down to pick up a small piece of paper from the floor, moments after Lucia suggested, ""Just record anything,"" and Katrina mentioned, ""There's only half an hour left,"" while Jake eagerly requested, ""Let me try, let me try."" I then began folding the paper twice, prompting Jake to ask, ""What's going on?"" and ""What's happening?"" followed by ""Why are you laughing?"". Shure then asked me ""Do you know people from Jiangsu?"". After unfolding the paper, Jake remarked, ""I'm also from Jiangsu,"" and ""But back then, I..."" I proceed to fold the paper twice again, during which Jake mentioned, ""I used to write essay prompts,"" twice. I jokingly suggest it ""Can be used as a dog's neck."" Then, I throw the paper again and Shure said, ""He didn't..."".",all_agents_current:Shure; all_agents_current:Lucia; all_agents_current:Tasha; all_agents_current:Alice,Shure D4 18:29:00.00-18:29:30.00; Lucia D4 18:15:30.00-18:16:00.00; Tasha D4 18:42:30.00-18:43:00.00; Alice D4 22:24:30.00-22:25:00.00; Lucia D4 18:33:30.00-18:34:00.00,all_agents_current,diagnose whether current context captions alone cover the answer evidence,unclear,global/statistical/temporal question with partial lexical overlap; caption coverage may be too local; answer_hits=shure; answer_coverage=1.00; question_overlap=2,yes
ESQP_CUR_003,HISTV1_003,1528,current_only,Who used the mirror the most after 6PM on DAY6?,Katrina,environmental_interaction,UNKNOWN,unknown,"[all_agents_current rank=1 score=10.7670 source=Lucia D6 19:53:30.00-19:54:00.00] The scene opens with me sitting amongst a group of people, most of whom are facing towards a projector screen at the front of the room. It’s DAY6, as indicated in the upper left corner of the frame. Jake adjusts his posture, while Violet sways in the background. My primary focus throughout the duration of the video is on my phone, which I am holding in my hand. The screen displays text in what appears to be Chinese. I continue to scroll and look at the content on my phone. I swipe up on the screen to navigate through the content displayed. The overall atmosphere is joyful, accompanied by the sound of Shure singing in the background.
[all_agents_current rank=2 score=7.7349 source=Alice D6 20:04:00.00-20:04:30.00] I was initially bending down, appearing to be searching for something, when I heard Shure, who was holding a guitar, say, ""How did I start again?"" I raised my phone to record. I then glanced to the left as Shure began playing the guitar and singing a song. Shure then said, ""Oh, how... what the heck."" Shortly after, I noticed Choiszt, who began walking towards our direction, seemingly towards the sofa. During this time, I overheard someone, presumably Jack, say, ""I'm being quiet again, can you call me?"". While Shure was singing ""I, I, I, I, I love it the most"" I continued recording as Choiszt walked into the room and sat down on the sofa. Shure then exclaimed, ""Oh, what the heck.""
[all_agents_current rank=3 score=7.6088 source=Jake D6 19:41:00.00-19:41:30.00] I observed Lucia standing up after she said, ""Stand up."" I heard Katrina telling someone, ""Sit on the second floor for a while, then you can go,"" as she spoke to a boy wearing a black coat. I looked at Lucia and started walking forward. The group began moving out of the living room area, and I turned to my right. Katrina then asked, ""Are you coming again tomorrow?"". I continued to walk forward, passing Violet, who was standing near the living room door. I turned left, arriving at the entrance of the house. I used my right hand to open the door, then walked out into the yard. I continued walking forward before bending down to pick up a fill light that was tilted on the ground. As I picked it up, I heard Jake saying, ""Oh, we're heading up.""
[all_agents_current rank=4 score=7.5550 source=Tasha D6 20:30:30.00-20:31:00.00] I am listening to a live performance. I glanced over at Jack, who is singing near the mirror; his voice seems quite pleasant. I noticed the photographer sitting down. I'm focusing on the performance, listening to Jack singing and Choiszt playing the guitar. I look ahead. Later, I turned my gaze towards Violet, who clapped her hands, appreciating the music. I am listening quietly.
[all_agents_current rank=5 score=7.5024 source=Tasha D6 19:39:30.00-19:40:00.00] the video shows me engaging with my phone while in an outdoor setting, presumably a backyard or patio. Initially, I opened the comment section of a video, watched the content briefly, and then exited that video. I then proceeded to open another video. After that, I started scrolling through content on my phone, moving slowly through various posts. At one point, I paused my phone use to glance towards the yard, observing my friends who were nearby. I tilted my head to the side for a moment before returning my head to its original position. Following that, I resumed looking at my phone and continued to scroll. I was lying on my side at some point as I used my phone, and then I leaned back for a moment. I continued to explore further content on my phone, and continued to operate my phone until the end of the video.",all_agents_current:Lucia; all_agents_current:Alice; all_agents_current:Jake; all_agents_current:Tasha,Lucia D6 19:53:30.00-19:54:00.00; Alice D6 20:04:00.00-20:04:30.00; Jake D6 19:41:00.00-19:41:30.00; Tasha D6 20:30:30.00-20:31:00.00; Tasha D6 19:39:30.00-19:40:00.00,all_agents_current,diagnose whether current context captions alone cover the answer evidence,partially_answerable,global/statistical/temporal question; captions mention answer-related terms but may not cover enough events to verify the full comparison/order; answer_hits=katrina; answer_coverage=1.00; question_overlap=3,yes
ESQP_CUR_004,HISTV1_004,1564,current_only,Who used the piano the most after 6PM on DAY6?,Nicous,environmental_interaction,UNKNOWN,unknown,"[all_agents_current rank=1 score=10.9944 source=Lucia D6 19:53:30.00-19:54:00.00] The scene opens with me sitting amongst a group of people, most of whom are facing towards a projector screen at the front of the room. It’s DAY6, as indicated in the upper left corner of the frame. Jake adjusts his posture, while Violet sways in the background. My primary focus throughout the duration of the video is on my phone, which I am holding in my hand. The screen displays text in what appears to be Chinese. I continue to scroll and look at the content on my phone. I swipe up on the screen to navigate through the content displayed. The overall atmosphere is joyful, accompanied by the sound of Shure singing in the background.
[all_agents_current rank=2 score=9.1216 source=Alice D6 20:48:30.00-20:49:00.00] I am observing a musical performance in what appears to be a living room setting. Choiszt is seated, playing a guitar, while Nicous is at the piano, and Jack stands in front of a projection screen, singing; a Shure microphone is being used. We are all listening to Jack sing. I am focused on Jack during the performance. A friend then reaches out and offers their hand, and I take it, holding hands with them. Following this, I engage in conversation with this same friend. I am talking with a friend.
[all_agents_current rank=3 score=7.9413 source=Alice D6 20:04:00.00-20:04:30.00] I was initially bending down, appearing to be searching for something, when I heard Shure, who was holding a guitar, say, ""How did I start again?"" I raised my phone to record. I then glanced to the left as Shure began playing the guitar and singing a song. Shure then said, ""Oh, how... what the heck."" Shortly after, I noticed Choiszt, who began walking towards our direction, seemingly towards the sofa. During this time, I overheard someone, presumably Jack, say, ""I'm being quiet again, can you call me?"". While Shure was singing ""I, I, I, I, I love it the most"" I continued recording as Choiszt walked into the room and sat down on the sofa. Shure then exclaimed, ""Oh, what the heck.""
[all_agents_current rank=4 score=7.4688 source=Jake D6 19:41:00.00-19:41:30.00] I observed Lucia standing up after she said, ""Stand up."" I heard Katrina telling someone, ""Sit on the second floor for a while, then you can go,"" as she spoke to a boy wearing a black coat. I looked at Lucia and started walking forward. The group began moving out of the living room area, and I turned to my right. Katrina then asked, ""Are you coming again tomorrow?"". I continued to walk forward, passing Violet, who was standing near the living room door. I turned left, arriving at the entrance of the house. I used my right hand to open the door, then walked out into the yard. I continued walking forward before bending down to pick up a fill light that was tilted on the ground. As I picked it up, I heard Jake saying, ""Oh, we're heading up.""
[all_agents_current rank=5 score=7.3659 source=Tasha D6 19:39:30.00-19:40:00.00] the video shows me engaging with my phone while in an outdoor setting, presumably a backyard or patio. Initially, I opened the comment section of a video, watched the content briefly, and then exited that video. I then proceeded to open another video. After that, I started scrolling through content on my phone, moving slowly through various posts. At one point, I paused my phone use to glance towards the yard, observing my friends who were nearby. I tilted my head to the side for a moment before returning my head to its original position. Following that, I resumed looking at my phone and continued to scroll. I was lying on my side at some point as I used my phone, and then I leaned back for a moment. I continued to explore further content on my phone, and continued to operate my phone until the end of the video.",all_agents_current:Lucia; all_agents_current:Alice; all_agents_current:Jake; all_agents_current:Tasha,Lucia D6 19:53:30.00-19:54:00.00; Alice D6 20:48:30.00-20:49:00.00; Alice D6 20:04:00.00-20:04:30.00; Jake D6 19:41:00.00-19:41:30.00; Tasha D6 19:39:30.00-19:40:00.00,all_agents_current,diagnose whether current context captions alone cover the answer evidence,partially_answerable,global/statistical/temporal question; captions mention answer-related terms but may not cover enough events to verify the full comparison/order; answer_hits=nicou; answer_coverage=1.00; question_overlap=3,yes
