qa_packet_id,source_case_id,question_id,evidence_scope,question,answer,category,provisional_query_user,query_user_status,evidence_text,evidence_sources,evidence_time_windows,evidence_modes,expected_use,auto_answerability_draft,auto_answerability_reason,needs_user_check
ESQP_CUR_019,HISTV1_019,2,current_only,"When Katrina helped finalize the list on the whiteboard, who seemed most actively giving her suggestions?",Lucia and Tasha,social_interaction,Katrina,inferred_weak,"[all_agents_current rank=1 score=10.4183 source=Tasha D1 13:55:00.00-13:55:30.00] I am holding a tablet and watching Katrina as she writes on a whiteboard. Initially, Jake and Lucia discuss the presence of lures, determining there shouldn't be any but only utensils, pots, and pans. Subsequently, Tasha lists items, including milk, light cream, eggs, starch, salt, saline, sugar, and heavy cream. I then engage in a discussion with Katrina about what we should buy, specifically regarding a small packet of milk powder. The conversation continues, with Tasha repeating ""Salt, a packet of milk powder"" as we further discuss the shopping list. I am actively browsing on my tablet while Katrina continues writing on the whiteboard, seemingly taking notes or compiling a list of items needed.
[all_agents_current rank=2 score=8.2861 source=Lucia D1 13:51:00.00-13:51:30.00] The video starts with a discussion about what kind of juice to buy. Katrina and I, Lucia, discussed ""fruity ones"" and whether they are generally acceptable. Katrina began writing on a whiteboard with a pen, presumably adding juice options to a list. I mentioned that we might still have orange juice with pulp, and then turned my head and looked around the room and at everyone present. I suggested adding coconut juice to the list and declared that we would consider it later. Katrina looked down at her phone, stating she'll check how to make a Pina Colada. I took a turn around the room, and then proceeded toward a table. I then picked up my phone from the table, turning it on. I removed a rubber band securing the phone.
[all_agents_current rank=3 score=8.2088 source=Shure D1 13:52:00.00-13:52:30.00] The video begins with my perspective focused on an object held in my left hand, where I am asked by Jake to disassemble and reassemble it. Shure then questions the presence of an extra screw. Subsequently, Jake suggests taking a break. I give a brief glance towards Katrina. Shure says that she found an extra screw, similar to a past experience assembling a computer. She puts the screws under the whiteboard. I then engage in cheerful conversation with Katrina, mentioning that she disassembled the notebook to clean the dust and completely took it apart. Looking at Katrina, I see her very happy. She mentions that after putting everything back together, she found two more screws. I communicate with Katrina about certain matters. Jake chimes in with suggestions to discard the useless components. I say that's right. Next, I touch my nose and continue walking. Jake then suggests to restock the things they bought. Eventually, I approach the whiteboard.
[all_agents_current rank=4 score=7.6931 source=Shure D1 13:47:30.00-13:48:00.00] The video begins with me, seemingly bored and aimless, as I overhear Tasha questioning, ""Hey, what's the use of putting it there?"" and Jake responding with, ""You take those people who just walk around randomly,"" followed by his happy laughter. As I continue to walk at my pace, I focus my attention on Katrina, who is actively writing something on a whiteboard. Lucia announces, ""Hey, KFC has beef burgers now."" Shure replies, ""They probably have similar ingredients."" I watch Katrina writing, and subsequently gesture with my left hand. Katrina responds with ""Match it as you wish."" I then shift my focus back to Jake. Shure says ""Just go with the flow,"" while Jake is gesturing with both hands. Shure then states ""Yeah, I've mixed all these things with vodka before"" while waving his hands. Finally, I point towards the whiteboard with my right hand.
[all_agents_current rank=5 score=7.6315 source=Shure D1 13:51:30.00-13:52:00.00] I started by suggesting, ""Just take the 万能的,"" gesturing with my right hand, and walked behind Alice as I continued to chat with everyone. I observed Katrina, then pointed at her, stating, ""Ah, the grapefruit flavor is for the container."" Katrina pointed at the whiteboard, and inquired, ""What does grapefruit taste like?"" I stood quietly, watching her, before Shure interjected, ""Just use them as drinks for any time,"" again gesturing with his right hand. He added, ""We can't drink these."" Alice then asked, ""Do we need to wash it?"" I made some suggestions to Katrina as Tasha chimed in, ""He said he'll wash it, yeah,"" which Jake confirmed with, ""Haha, yeah, exactly."" I then took a few steps and made a strange sound. Tasha then advised, ""Take a break."" Afterwards, I walked over to Katrina's side, adding ""You've already organized a lot of stuff."" Alice then said ""It's okay, yes."" As I continued to look at my friends in front of me, Jake reinforced the sentiment, ""Yes, take a break,"" and Shure echoed, ""Take a break."" Finally, Jake concluded with, ""Disassemble it and put it back together again.""
[external_current rank=1 score=10.4183 source=Tasha D1 13:55:00.00-13:55:30.00] I am holding a tablet and watching Katrina as she writes on a whiteboard. Initially, Jake and Lucia discuss the presence of lures, determining there shouldn't be any but only utensils, pots, and pans. Subsequently, Tasha lists items, including milk, light cream, eggs, starch, salt, saline, sugar, and heavy cream. I then engage in a discussion with Katrina about what we should buy, specifically regarding a small packet of milk powder. The conversation continues, with Tasha repeating ""Salt, a packet of milk powder"" as we further discuss the shopping list. I am actively browsing on my tablet while Katrina continues writing on the whiteboard, seemingly taking notes or compiling a list of items needed.
[external_current rank=2 score=8.2861 source=Lucia D1 13:51:00.00-13:51:30.00] The video starts with a discussion about what kind of juice to buy. Katrina and I, Lucia, discussed ""fruity ones"" and whether they are generally acceptable. Katrina began writing on a whiteboard with a pen, presumably adding juice options to a list. I mentioned that we might still have orange juice with pulp, and then turned my head and looked around the room and at everyone present. I suggested adding coconut juice to the list and declared that we would consider it later. Katrina looked down at her phone, stating she'll check how to make a Pina Colada. I took a turn around the room, and then proceeded toward a table. I then picked up my phone from the table, turning it on. I removed a rubber band securing the phone.
[external_current rank=3 score=8.2088 source=Shure D1 13:52:00.00-13:52:30.00] The video begins with my perspective focused on an object held in my left hand, where I am asked by Jake to disassemble and reassemble it. Shure then questions the presence of an extra screw. Subsequently, Jake suggests taking a break. I give a brief glance towards Katrina. Shure says that she found an extra screw, similar to a past experience assembling a computer. She puts the screws under the whiteboard. I then engage in cheerful conversation with Katrina, mentioning that she disassembled the notebook to clean the dust and completely took it apart. Looking at Katrina, I see her very happy. She mentions that after putting everything back together, she found two more screws. I communicate with Katrina about certain matters. Jake chimes in with suggestions to discard the useless components. I say that's right. Next, I touch my nose and continue walking. Jake then suggests to restock the things they bought. Eventually, I approach the whiteboard.
[external_current rank=4 score=7.6931 source=Shure D1 13:47:30.00-13:48:00.00] The video begins with me, seemingly bored and aimless, as I overhear Tasha questioning, ""Hey, what's the use of putting it there?"" and Jake responding with, ""You take those people who just walk around randomly,"" followed by his happy laughter. As I continue to walk at my pace, I focus my attention on Katrina, who is actively writing something on a whiteboard. Lucia announces, ""Hey, KFC has beef burgers now."" Shure replies, ""They probably have similar ingredients."" I watch Katrina writing, and subsequently gesture with my left hand. Katrina responds with ""Match it as you wish."" I then shift my focus back to Jake. Shure says ""Just go with the flow,"" while Jake is gesturing with both hands. Shure then states ""Yeah, I've mixed all these things with vodka before"" while waving his hands. Finally, I point towards the whiteboard with my right hand.
[external_current rank=5 score=7.6315 source=Shure D1 13:51:30.00-13:52:00.00] I started by suggesting, ""Just take the 万能的,"" gesturing with my right hand, and walked behind Alice as I continued to chat with everyone. I observed Katrina, then pointed at her, stating, ""Ah, the grapefruit flavor is for the container."" Katrina pointed at the whiteboard, and inquired, ""What does grapefruit taste like?"" I stood quietly, watching her, before Shure interjected, ""Just use them as drinks for any time,"" again gesturing with his right hand. He added, ""We can't drink these."" Alice then asked, ""Do we need to wash it?"" I made some suggestions to Katrina as Tasha chimed in, ""He said he'll wash it, yeah,"" which Jake confirmed with, ""Haha, yeah, exactly."" I then took a few steps and made a strange sound. Tasha then advised, ""Take a break."" Afterwards, I walked over to Katrina's side, adding ""You've already organized a lot of stuff."" Alice then said ""It's okay, yes."" As I continued to look at my friends in front of me, Jake reinforced the sentiment, ""Yes, take a break,"" and Shure echoed, ""Take a break."" Finally, Jake concluded with, ""Disassemble it and put it back together again.""",all_agents_current:Tasha; all_agents_current:Lucia; all_agents_current:Shure; external_current:Tasha; external_current:Lucia; external_current:Shure,Tasha D1 13:55:00.00-13:55:30.00; Lucia D1 13:51:00.00-13:51:30.00; Shure D1 13:52:00.00-13:52:30.00; Shure D1 13:47:30.00-13:48:00.00; Shure D1 13:51:30.00-13:52:00.00,all_agents_current; external_current,diagnose whether current context captions alone cover the answer evidence,likely_answerable,"evidence covers most answer keywords and overlaps with the question context; answer_hits=and,lucia,tasha; answer_coverage=1.00; question_overlap=6",yes
ESQP_CUR_020,HISTV1_020,170,current_only,"Who helped each other find scissors, and what were the scissors used for?",Jake handed scissors to Katrina for her package and flower crafts.,social_interaction,UNKNOWN,unknown,"[all_agents_current rank=1 score=11.6825 source=Katrina D4 12:26:30.00-12:27:00.00] First, I am seen cutting a flower stem with blue-handled scissors. Subsequently, I put the scissors down and hold the flower. I then reach for my phone, pick it up, and operate it to open the WeChat application. Within WeChat, I navigate through the interface by sliding. I then open the camera feature within the application. I proceed to attempt to take a photograph of the flower, adjusting the angle to find an ideal composition, but seem to be unsuccessful in initially achieving the desired framing. Finally, I take a photograph of the flower and then, I put down the flower. Lastly, I exit the camera application on my phone.
[all_agents_current rank=2 score=11.6216 source=Lucia D4 12:10:00.00-12:20:00.00] The day felt aimless at first, I remember watching my hands before my attention shifted to Alice, who was styling their hair. I ran my fingers through my own hair and, picking up my phone from my leg, started a conversation with Alice about the date. We were trying to figure out how many days we'd been here, doing some mental math and then checking my phone's calendar. We landed on around four and a half days, if we counted the first partial day as half a day. Our conversation then veered into food, specifically spring vegetables. I admitted I'd never had ""椿菜"" (toon shoots), sparking a brief explanation from Alice. I wondered if something like fish skewers counted. Later, I found myself brushing dust off my pants, listening to Alice express contentment with the quiet life and wanting a small yard. I agreed, but specified I wanted flower beds instead of gravel. Then, I picked up a bottle opener from the table and fiddled with it, thinking it would be a good hand exercise, before putting it back down and picking at dirt on my hands, a little embarrassed by their condition. I sang to myself a bit, specifically ""think of me,"" before asking Alice about their headphones, which they'd taken off when I approached. The conversation shifted again, as I mentioned feeling sleepy and wanting to go to bed, leading to a discussion about going to bed late the night before. I pat the dust off my pants again. Then, after noting I had stuff to do, I decided against wearing my glasses and just focused on visually scanning our surroundings, still chatting with Alice as they styled their hair. After overhearing Lucia saying that other people are having so much fun, I thought about checking for activities we could plan, and even considered setting up my little bedside table. Soon, the discussion turned to online shopping, mentioning Lucia's preferences for Taobao and JD.com. I told Alice that I had checked on the time. After this, I talked with Alice a little bit about the photo wall I was planning to buy and what I thought about decorating it and what my decor style was. Opening the JD app on my phone, I checked previous purchases and was telling Alice about an ambient light that I had considered buying for my room. After I found out it was mainly used by streamers, I switched to thinking about getting a night light and talked about how expensive a water ripple light would be. We transitioned to discussing logistics for JD.com and Pinduoduo, and I looked at Jake and Alice. Then, Jake suggested Pinduoduo, so I followed up with brushing my hair and asking about delivery times. Jake was moving a bunch of things inside, so I got up and followed behind him, grabbing the door. I got caught up in explaining to Jake the unpacking procedure, differentiating items for the first floor from those destined for the second, and mentioned that I thought only one package was arriving for me today. To illustrate, I grabbed my phone and showed Alice a picture of a night light I'd bought that I thought was really cute, asking for their opinion as I mentioned that it came in one of the packages. When I got up, I went to walk toward the entrance of the building, since I saw Tasha headed that way too. I looked in the room with a bunch of packages and a washing machine. Then, I picked up a package and tried to figure out who it belonged to by asking people and opening packages, trying to identify the owner of these deliveries. We discussed buying packages from an online sticker vendor. Eventually, I had to set a package on a bigger box, since there were so many packages to look through. I grabbed another small, white package, asking for scissors to open it up. Then, I couldn't find scissors, so I wondered if the package was mine. Finally, I pulled a foam box package, tried to pull another box, and turned to head toward the terrace. Soon after, I chatted with Jake and Tasha and then noticed Alice was next to me. Finally, I was talking with Jake and Alice about Mandarin and dialects.
[all_agents_current rank=3 score=10.4958 source=Jake D4 12:24:00.00-12:24:30.00] The video begins with a conversation where Katrina is stating, ""Do we have more scissors?"", then ""Are we short on scissors?"", followed by ""They don't have enough to open packages."" I respond with, ""Hmm, hmm, hmm, speechless."" As lyrical music plays in the background, I walk into what appears to be a computer room. I take a brief look around the space, glancing at a stool. I kick the stool. More lyrical music plays as I pick something up from the room, accidentally bumping into the bed. I retrieve an item from the bed, which is a pair of scissors. I then exit the room holding the scissors in my hand as the background music continues. I walk back to Katrina and hand her the scissors, then I say, ""Useful, right?"". After that, I look at the table and put the scissors away properly.
[all_agents_current rank=4 score=10.3948 source=Katrina D4 12:24:00.00-12:24:30.00] The video begins with me asking Jake, ""Do we have more scissors?"" followed by, ""Are the scissors not enough?"" I clarify, ""They don't have enough for opening packages."" As I speak, my attention is on a flower, and I begin to fiddle with it. Jake looks at me, seemingly searching for something in response to my question. I continue to fiddle with the flower, pulling off some petals and then turning the flower upside down on a piece of paper. I reach out my hand, pick up something, and continue to fiddle with the flowers. I look towards Jake and say, ""Thank you."" as he hands me a pair of scissors. I then place the scissors on the table.
[all_agents_current rank=5 score=10.0046 source=Jake D4 12:20:00.00-12:30:00.00] I started out chatting with Lucia and Alice outside at a long table. The conversation was already underway about Shaanxi dialects, with Lucia admitting she couldn't really tell them apart, even though her grandparents spoke a dialect different from her roommates. Then, I got busy cleaning up, picking up discarded cardboard and paper and putting them in a white plastic bag, mentioning to the group that more cleaning was needed. Next thing I knew, Tasha was handing out desserts, and I exclaimed about putting them there, noting there was no sun and agreeing it might be the paint smell. After that, I announced I'd bought lunch, specifically toon pancakes, and clapped excitedly when Tasha appeared with more food. Alice mentioned it was Grain Rain, a day to eat toon sprouts. I made a joke about an ""extra, random step"" and then admitted I didn't know what was going on either, saying ""today really lacks lifestyle taste."" Later I reached out and took an object from Tasha, initiating a conversation with the girls about what toon was, as I began tearing the plastic bag. We then moved onto unpacking a small bookshelf that Tasha brought, with me inspecting the pieces and joking about splitting one and taking it home. Eventually, it was time to install the shelves! After some chuckles, I picked up a piece, and noticed that they didn't give the screws for it, but in the end I made it work. There were two more pieces of the box, then I went on with conversation. After a little while, I took a break and declared there was ""no sunbathing today,"" wiping my glasses and feeling a ""bit of a loss"" heading indoors. Inside, I walked into the kitchen area, hearing music playing and briefly seeing Katrina on her phone, ""That sharpness lingers more and more"". Then I went back to Katrina to try to get some scissors, and found them bumping into the bed. After that, I went outside and saw a pair of hands that I stared at. Shure followed into the kitchen too. Lastly, I grabbed a screwdriver and headed into the computer room to grab something next to a pair of headphones and went outside, showing it to Tasha and Jake. It was a Xiaomi screwdriver set! We talked about how Xiaomi also had them, reminiscing about my quarantine back home. I ended up sitting down, explaining that I used it for taking apart the computer, and how someone once took my mic apart and never put it back together. With that, we headed to a table and assembled disassembled wooden shelves spread. I tried to put it back together when Lucia picked up a piece of shelf and noticed that they disassemble, but still useable. Eventually, I started working on assembling some small wooden drawers, with Tasha helping me take them out, Lucia laughing, and Alice asking about the toon pancakes. The Baidu Wenxin being closed was mentioned, and Shure watched as we chatted about what Gu Yu wanted to eat, what to order. Ultimately, we decided to order dumplings along with our special Chinese toon pancakes. Then, I was showing Shure the box and adjusting direction of the box for best direction. The rest of the conversation was the color of wood, and the French term. ""C'est la vie."" Later Lucia, Jake, and Tasha were conversing, correcting each other with ""we"". Also I can see pieces of boxes scattered and tools like a screwdriver and a bit set. After more construction, Lucia made a comment on languages, and later asked, ""What about the screws,"" followed by Tasha noting, ""Only gave 4 screws."" And in the end, I installed screws into drawer, and Lucia, Jake, and Tasha talking about police chief. Lastly, it was brought up that they should translate the box because google doesn't work, where Jake talks about it being ""The outside of the wall"".",all_agents_current:Katrina; all_agents_current:Lucia; all_agents_current:Jake,Katrina D4 12:26:30.00-12:27:00.00; Lucia D4 12:10:00.00-12:20:00.00; Jake D4 12:24:00.00-12:24:30.00; Katrina D4 12:24:00.00-12:24:30.00; Jake D4 12:20:00.00-12:30:00.00,all_agents_current,diagnose whether current context captions alone cover the answer evidence,likely_answerable,"evidence covers most answer keywords and overlaps with the question context; answer_hits=and,flower,for,hand,jake,katrina,package,scissor; answer_coverage=0.89; question_overlap=5",yes
