qa_packet_id,source_case_id,question_id,evidence_scope,question,answer,category,provisional_query_user,query_user_status,evidence_text,evidence_sources,evidence_time_windows,evidence_modes,expected_use,auto_answerability_draft,auto_answerability_reason,needs_user_check
ESQP_CUR_026,HISTV1_026,915,current_only,Why was Katrina initially confused about what was happening with the ball during the game?,She assumed it would require manual intervention to release the ball.,theory_of_mind,Katrina,inferred_weak,"[all_agents_current rank=1 score=12.4274 source=Lucia D3 16:20:00.00-16:30:00.00] I started off completely absorbed in a round of Initial D Zero, fiercely gripping the steering wheel and making constant adjustments to stay on the virtual track, determined to win. I played hard, but after the race, the game ended, and I took a moment to adjust my glasses. Afterwards, there was a bit of discussion with Jake and Lucia about whether to play again, which I was reluctant about due to the card needing to be renewed. We realized we needed more coins and were just generally confused on how it worked, then decided to move on. I offered up the remaining coins I had, wondering if anyone wanted to try the doll-catching games. The group and I discussed different games and what their coin costs were. We soon realized we had plenty of coins from previous plays and could continue. We moved over to a virtual bowling game, where Jake used the spare coins that were left from the last turn to set up a new game. After seeing Shure's impressive strikes, Katrina gave me a pep talk before it was my turn. I was a little clumsy and asked Jake for help with aiming, and he coached me on where to aim, and I nervously took a sip of water. After me came others. We spent a few turns, and then the focus shifted to Katrina as she played, and Jake commented she was throwing them very casually. After a few rounds we moved on from bowling and Lucia asked why she got a gun. I clapped as Violet joined in on the games. We threw more balls until Jake mentioned we had two coins left, and Lucia suggested we use them. I held the coins in my hand, then turned around to look at a game console. Lucia suggested ice hockey, so we continued walking, now looking for a good coin pusher machine. We stopped in front of a few different machines, trying to figure out which one looked the most promising, or was the easiest to win on. Lucia kept pointing at other machines. After a few suggestions, we put in a coin and pressed the button, and I shared a smile with the group when some coins didn't drop. Discouraged, and remembering easier days when she played coin pushers, Lucia suggested we leave. Finally, it was refreshing when we headed out of the arcade to find Jake in Miniso, as Lucia commented on how noisy it was inside.
[all_agents_current rank=2 score=12.3046 source=Jake D3 16:20:00.00-16:30:00.00] We're at the arcade again, and it all started with us at a bowling game. I made comments about hitting the target and the lighter grand prize. Tasha wondered if you had to hit them all at once for the grand prize, and I said it seemed like it, walking up to the game as Tasha threw a ball. We commented on the score and I clapped, carrying a box I'd won, feeling like it was worth it, though I was out of coins. Tasha pointed out we had one left for the basketball game, and I glanced around before seeing Lucia playing a game Katrina had used. I asked if she had more credits and if it was okay for her to play again, then told her to make a decision. Shure then said something about renewing a subscription. We stood up and prepared to leave, mentioning how much we ""harvested,"" and then started discussing a decoration group before heading through a doorway.\n\nAs we walked, I noticed Lucia still had coins, surprising me. I signaled the others to come back, saying there were three coins left, and we debated what game to play. I pointed out a bowling game, saying it cost a dollar and had already been played. I told Tasha she needed one more coin to play and said we could make money with money. I laughed with Shure about a sports analogy that confused him. Then, I pointed out a dinosaur-themed bowling game and someone suggested buying votes to win. We talked about previous players and the game's mechanics, then watched Shure throw the ball, exclaiming ""Awesome."" I clapped and watched the screen, waiting for the results, then Jake declared it was time to move on. I prompted Lucia to play the ""monster catcher,"" grabbing her water bottle and clothes for her. I gave her instructions on how to aim, counting down her attempts. Tasha threw a ball at the bowling game and I watched the group, and as Katrina and Violet prepared to play. Jake teased Shure playfully and I watched the game. After more encouragement, I called for Violet to have a turn, observing as she threw the ball down the lane. After that, I stared at a screen and then asked about nemesis. I pointed and asked about someone named Kexin, then gestured towards Alice. After someone asked how many coins, I remarked that it was one by one. Then, I showed them the screen.\n\nNext, I filmed Lucia playing an arcade game while encouraging her and watching. After cheering Lucia's turn, I started walking out, and after that, I checked the haunted house, opening the curtains and remarking about it being ""Funny."" Then, I turned to walk through a door with Alice. I watched people around a game, listening to them talk. Then, I stood behind Shure as Lucia advised him how to play. I urged us to move forward and reminisced about how easy the coin pusher games were when I was little. Tasha and I were discussing the coin-operated game and formulating a strategy. Tasha pushed it off, but it didn't fall. After we talked about the game's mechanics and I mentioned putting in more coins, I stated, ""Right, right, right."" I then walked forward, exiting through a doorway, and leaving the arcade area.
[all_agents_current rank=3 score=11.1338 source=Alice D3 16:20:00.00-16:30:00.00] it was Day 3, and I was hanging out with Violet, Alice, Katrina, Shure, Lucia, Jake, and Tasha at the arcade. We were chatting about drinks; Violet was sharing ideas about making her own juice and adding Wangzai milk to tea. Then, Shure started playing a racing game, and there was some playful banter about him competing against himself or the computer. After a bit, Violet put on her coat, and we started to think about leaving. I was messing with my phone, logging out of WeChat and then opening another app, while hearing Jake mention ""Harvesting a lot"". We started to walk out, and then Jake mentioned that we should go back to prove that we were there. We changed our minds and walked back to the group after Jake mentioning ""there are still three more"". After that, I was messing with my phone some more, trying to make money from money. I went back to scrolling through Xiaohongshu, looking at pictures and articles, and listening to music. The others were still engrossed in arcade games, and I was just observing and scrolling through content, swiping through videos and commenting. Then after some more rounds of gaming, we were around a coin pusher; I was watching Lucia play this game. After some time, we started making our way out, but then Shure realized Jake wasn't with us. We started to walk out of the arcade and into the mall, and Katrina asked, ""Hey, why are we at MINISO with Ultraman?"" It seemed like we were heading towards the MINISO store, and Alice mentioned Barbie as we went in that direction.
[all_agents_current rank=4 score=10.8711 source=Shure D3 16:20:00.00-16:30:00.00] Alright, Day 3 at the arcade! The first thing I did was take a good look around the massive place, just soaking it all in and getting my bearings. I found Katrina and Tasha engrossed in some games, particularly a racing one that Katrina won, feeling pretty good about it. I wandered off to explore other sections of the arcade, eventually suggesting we move on. It took a little convincing, with Lucia sounding hesitant, but we eventually agreed. I hopped on a ""Initial D Zero"" racing game for a quick go, but it was short-lived. I remember joking around about it being over, with Katrina pointing out something on the ""bed"" for decoration and Jake making some funny comments about catching up with ""this part."" We then headed out of the arcade for a bit. After that, Lucia asked about the dolls she'd grabbed, apparently quite a few. I wandered over to a coin pusher game, thinking we could ""make money to make money"", and we noticed a bowling pin inside. Then, we all followed Jake to a different game, talking about strategy, cigarette butts, and laughing. We found another game and then decided on a ""2/3"" strategy after some discussion about ""bodhisattvas"" and multiple votes. I picked up a ball and took my turn, throwing it and hearing comments about how it combined reality and the screen. I threw another ball, practiced, and heard jokes from Jake. We all took turns, Lucia had a go and I gave her some advice on the best stance. Next Tasha did very well and got a ""turkey"" on the screen, and then it was Katrina's turn. Jake was quite vocal, shouting ""More!"" It was Violet's turn so then she gave items and a ball to Lucia. We then played some more and got a good score, with everyone clapping and cheering. After that, I wandered toward another coin pusher game, I had my special card and thought I'd give it a go! We had another look at the coin game, talking about techniques. ""He, he, he puts it in"" and I put a coin in but I failed to release the coins so we moved on, with Jake commenting, ""This is the butterfly effect."" After a while, we gave up on the coin pusher, with Lucia reminiscing about how easier it used to be and claiming she ""won"". Finally, we left the arcade with Lucia, and I remember adjusting my glasses. It was so loud inside and refreshing outside, then Shure asked where Jake was and we called out for ""Hema.""
[all_agents_current rank=5 score=8.9416 source=Katrina D3 16:30:00.00-16:40:00.00] I headed out to the sale store because I needed to get face towels and sanitary napkins. A couple of people said they'd come along. Once we got there, at a store called ""HotMax,"" the group debated what kind of sanitary napkins to get and if there were any special deals. I was also hoping to find compressed face towels, but they didn't have the small bags I was used to, so it looked like I would have to buy a big pack. Katrina suggested we share it. Shure suggested using kitchen paper to wash my face, haha. After picking up a couple of packs of sanitary napkins, I took over some stuff Violet had picked up, and we all headed to the checkout. Katrina paid using WeChat, and I put everything in a HotMax bag. Katrina then recommended ""Hot Buy"" across from school for cheap daily necessities. I continued to follow everyone to another store, which appeared to be a liquor/grocery store.\n\nThe group then started to discuss buying wine for fun, debating the quality and whether it was Moscato. Jake was really pushing it, and Alice wanted sparkling wine so it would make a ""pop"" sound. Lucia was sharing a funny story about her first time opening a bottle with a friend. Then I looked at them all and walked away. Shure was wondering about things to buy, and Katrina was asking about canned yellow peaches and other snacks, haha. We discussed if they really cure colds, which got pretty silly. Katrina decided to buy a pack of ""Mimi"" snacks, and I picked up something from the shelf as well, haha. I took a look at this peppermint candy. Someone needed to put it in Katrina's bag to be paid for. Jake joked that we should convert all the prices to Singapore dollars.\n\nI converted everything into Singapore Dollars. I picked up some things, but then decided to leave them. At the checkout counter, everyone was still converting to Singapore dollars. Katrina put my drink in her bag because she was already paying for everything. Next, I went to put items in Katrina's bag, and there was some discussion on whose bag was heavier. Then I started walking, turning left, which probably was to go to the next store. I then asked the group where Hema was, and we had some discussion of our tasks and where the ""good box"" needed to go. We got onto the escalator, and I saw a message from Jake on WeChat telling me to take care of something and recharge, so I was back on the hook.\n\nThen, Violet pointed out some caramelized sunflower seeds in a store. I asked if they liked durian, and we discussed needing to buy stuff for grilling. I was looking at tiramisu cake. I saw some items in a freezer and looked at items with the others, which was for grilling. I began standing in front of a refrigerator and put my clothes down on a nearby shelf and I picked up my phone to take a photo of something. I began discussing all the things we should get for grilling, then took another photo with my phone. I walked over to the refrigerator, looking at the freezer, and specifically mentioned grilled meat slices.
[self_current rank=1 score=12.9874 source=Katrina D3 16:30:00.00-16:40:00.00] I headed out to the sale store because I needed to get face towels and sanitary napkins. A couple of people said they'd come along. Once we got there, at a store called ""HotMax,"" the group debated what kind of sanitary napkins to get and if there were any special deals. I was also hoping to find compressed face towels, but they didn't have the small bags I was used to, so it looked like I would have to buy a big pack. Katrina suggested we share it. Shure suggested using kitchen paper to wash my face, haha. After picking up a couple of packs of sanitary napkins, I took over some stuff Violet had picked up, and we all headed to the checkout. Katrina paid using WeChat, and I put everything in a HotMax bag. Katrina then recommended ""Hot Buy"" across from school for cheap daily necessities. I continued to follow everyone to another store, which appeared to be a liquor/grocery store.\n\nThe group then started to discuss buying wine for fun, debating the quality and whether it was Moscato. Jake was really pushing it, and Alice wanted sparkling wine so it would make a ""pop"" sound. Lucia was sharing a funny story about her first time opening a bottle with a friend. Then I looked at them all and walked away. Shure was wondering about things to buy, and Katrina was asking about canned yellow peaches and other snacks, haha. We discussed if they really cure colds, which got pretty silly. Katrina decided to buy a pack of ""Mimi"" snacks, and I picked up something from the shelf as well, haha. I took a look at this peppermint candy. Someone needed to put it in Katrina's bag to be paid for. Jake joked that we should convert all the prices to Singapore dollars.\n\nI converted everything into Singapore Dollars. I picked up some things, but then decided to leave them. At the checkout counter, everyone was still converting to Singapore dollars. Katrina put my drink in her bag because she was already paying for everything. Next, I went to put items in Katrina's bag, and there was some discussion on whose bag was heavier. Then I started walking, turning left, which probably was to go to the next store. I then asked the group where Hema was, and we had some discussion of our tasks and where the ""good box"" needed to go. We got onto the escalator, and I saw a message from Jake on WeChat telling me to take care of something and recharge, so I was back on the hook.\n\nThen, Violet pointed out some caramelized sunflower seeds in a store. I asked if they liked durian, and we discussed needing to buy stuff for grilling. I was looking at tiramisu cake. I saw some items in a freezer and looked at items with the others, which was for grilling. I began standing in front of a refrigerator and put my clothes down on a nearby shelf and I picked up my phone to take a photo of something. I began discussing all the things we should get for grilling, then took another photo with my phone. I walked over to the refrigerator, looking at the freezer, and specifically mentioned grilled meat slices.
[self_current rank=2 score=7.3342 source=Katrina D3 16:20:00.00-16:30:00.00] The video begins with me deeply engrossed in playing the ""Initial D Zero"" arcade game, gripping the steering wheel and skillfully navigating the race course. ""Wow,"" I eventually exclaim, feeling satisfied with my performance and take a short break, taking my hands off the wheel and looking down momentarily. I then get up, turn around, and collect some of my belongings: a power bank, some clothes, and a doll. Phone in hand, I walk over to the game console, take a photo and then open WeChat and begin an active messaging exchange. During the messages, I receive replies from ""Jake"" and ""Lucia."" ""Oh no, it's over,"" I hear Jake say, marking the end of the game, and I prepare to move on. I pick up my water bottle and stand up, turning to join the rest of the group. Katrina's voice rings out with excitement about decorations for a bed, and Jake proudly declares that we have proof that we were here. As we walk through the arcade, the others discuss their winnings and various games they'd like to play. The group decides to focus on some remaining coins and play some coin pushing games, I hear Tasha saying she wants to play a Rhythm Master game.\n\nI watch them engage with the games, occasionally taking a sip from my drink and capturing the scene on my phone, taking pictures and then recording videos. Jake, Lucia, and Katrina analyze one of the consoles, discussing its features and performance, with Shure suggesting I train him on the game. As they continue playing, I check my phone, looking for messages from Tasha and Jake about the ongoing game. I even send a video I recorded in the group chat, which Jake quickly responds to with excitement. I see that Tasha got a ""spare"" in the game behind me and I send more texts. After finishing my text message, I turn my head to listen to Jake as he says ""You only get one shot at turkey strike"" and ""Strike all pins and you get a turkey"". With the group ready to move on, I hand off some items to Violet, and proceed to play a round of bowling. Shure comments on how relaxed I am, and I squat down to pick up the ball.\n\nAfter releasing the ball, and as Katrina laughs and jokes, I end up handing the drink and clothes back to Violet, and she enthusiastically says ""Hey, why so many?"". As Violet plays the game again, Shure notes a potential split. The group's enthusiasm builds as Violet succeeds, and I call out, ""Awesome!"" Then, after Violet finishes the game, the focus shifts back to the coin pushers, with Tasha and Jake excitedly discussing the possibility of more winnings, and Lucia suggesting that there might be more prizes to come. ""You know this one has a diamond, right?"" Jake is heard saying. After a final encouragement to Lucia as she plays, and with a final triumphant ""Yay"" as she wins something in a game, I announce, ""Alright, let's go,"" and we prepare to leave the coin pusher games. Katrina then states, ""I'm going shopping,"" and Jake responds with, ""We still have two coins,"" and they discuss how those two coins can make money, and as the rest of the group discuss ""money makes money"", I observe them briefly before focusing my attention on looking for one last game before we head to shopping. I end the video watching them play a coin pusher. We discuss strategies, with Shure offering ""I'll teach you a trick"" while Lucia remarks ""This is actually quite hard"". We move from the arcade over to a Miniso looking for a specific item.
[self_current rank=3 score=7.2357 source=Katrina D3 16:25:30.00-16:26:00.00] Initially, I'm looking down, seemingly amused by a doll, as Katrina laughs and remarks on my casual demeanor while Jake makes comments like, ""There, there, there"" and ""That's hilarious."" I then focus my attention on the game console in front of me, continuing to observe it intently while Katrina and Jake discuss the arrival of the ball. After briefly brushing my hair, I squat down to pick up a bowling ball. I throw the bowling ball. I then look ahead. As the ball travels down the lane, I speak. Following that, I brush my hair a bit. Then, Jake calls out, ""Violet, come here."" I turn back to look at them, then walk forward towards their location.
[self_current rank=4 score=6.5381 source=Katrina D3 16:25:00.00-16:25:30.00] Okay, let me describe what I see and do in this video from my perspective. It begins with me finishing up a message exchange on my phone with ""Jake: Haha, no worries, left or right doesn't matter."" After exiting WeChat, I look up at a game console and then at everyone around me. I continue looking at the game console. The conversation continues with ""Tasha: Ah, I'm better than you, haha,"" and ""Jake: More than you, more than you, more than you."" My gaze shifts back to the group, and I hear ""Katrina: This simulation isn't him,"" and ""Katrina: Imagine as much as you want,"" followed by ""Jake: The more off, the higher the score, you know?"" I place my hand next to the round disk control in front of me, pointing to the game console. My focus returns to the console as I say ""Jake: Come on, come on, come on."" Katrina then asks, ""Katrina: My turn?"" I walk forward, then turn back to hand some items to Violet, right after I heard ""Katrina: Yay"". I walk forward again, approaching the game console to play. I squat down to pick up the bowling ball, while Shure comments, ""Shure: You're so casual about this."" Finally, I look back at them as Jake exclaims, ""Jake: Haha, slipped my hand.""
[self_current rank=5 score=6.0524 source=Katrina D3 16:29:00.00-16:29:30.00] The video begins with my gaze fixed on a series of brightly lit game consoles, specifically coin pushers, with Shure commenting ""Yeah, yeah."" Katrina asks, ""How do you play this?"" while Lucia responds ""Then press it and it'll drop"" and ""Press it gently, haha."" I continue to observe the consoles as Shure says ""Okay, release,"" and Katrina again asks ""Is this how you play it?"", Jake says ""Yeah"", and Lucia says ""It seems stuck, haha."" I then shift my head, looking around at the people accompanying me as Katrina repeats ""Is this how you play it?"". Jake then says, ""Let's go, haha,"" and Katrina remarks ""It just drops down."" I pan to observe the group of people I am with, then begin walking forward alongside them as Jake says ""Let's go, let's go."" I briefly turn my head to the left to re-examine the game consoles, before returning my gaze forward. Lucia says, ""I remember when I was a kid... This coin pusher is super easy to drop coins."" Then, I turn my head to the left before looking forward again, as Lucia continues with ""But now it seems they've modified it to make it harder."" Finally, I turn my head to the left to look at Tasha, and then I face forward.
[external_current rank=1 score=11.7728 source=Lucia D3 16:20:00.00-16:30:00.00] I started off completely absorbed in a round of Initial D Zero, fiercely gripping the steering wheel and making constant adjustments to stay on the virtual track, determined to win. I played hard, but after the race, the game ended, and I took a moment to adjust my glasses. Afterwards, there was a bit of discussion with Jake and Lucia about whether to play again, which I was reluctant about due to the card needing to be renewed. We realized we needed more coins and were just generally confused on how it worked, then decided to move on. I offered up the remaining coins I had, wondering if anyone wanted to try the doll-catching games. The group and I discussed different games and what their coin costs were. We soon realized we had plenty of coins from previous plays and could continue. We moved over to a virtual bowling game, where Jake used the spare coins that were left from the last turn to set up a new game. After seeing Shure's impressive strikes, Katrina gave me a pep talk before it was my turn. I was a little clumsy and asked Jake for help with aiming, and he coached me on where to aim, and I nervously took a sip of water. After me came others. We spent a few turns, and then the focus shifted to Katrina as she played, and Jake commented she was throwing them very casually. After a few rounds we moved on from bowling and Lucia asked why she got a gun. I clapped as Violet joined in on the games. We threw more balls until Jake mentioned we had two coins left, and Lucia suggested we use them. I held the coins in my hand, then turned around to look at a game console. Lucia suggested ice hockey, so we continued walking, now looking for a good coin pusher machine. We stopped in front of a few different machines, trying to figure out which one looked the most promising, or was the easiest to win on. Lucia kept pointing at other machines. After a few suggestions, we put in a coin and pressed the button, and I shared a smile with the group when some coins didn't drop. Discouraged, and remembering easier days when she played coin pushers, Lucia suggested we leave. Finally, it was refreshing when we headed out of the arcade to find Jake in Miniso, as Lucia commented on how noisy it was inside.
[external_current rank=2 score=11.6154 source=Jake D3 16:20:00.00-16:30:00.00] We're at the arcade again, and it all started with us at a bowling game. I made comments about hitting the target and the lighter grand prize. Tasha wondered if you had to hit them all at once for the grand prize, and I said it seemed like it, walking up to the game as Tasha threw a ball. We commented on the score and I clapped, carrying a box I'd won, feeling like it was worth it, though I was out of coins. Tasha pointed out we had one left for the basketball game, and I glanced around before seeing Lucia playing a game Katrina had used. I asked if she had more credits and if it was okay for her to play again, then told her to make a decision. Shure then said something about renewing a subscription. We stood up and prepared to leave, mentioning how much we ""harvested,"" and then started discussing a decoration group before heading through a doorway.\n\nAs we walked, I noticed Lucia still had coins, surprising me. I signaled the others to come back, saying there were three coins left, and we debated what game to play. I pointed out a bowling game, saying it cost a dollar and had already been played. I told Tasha she needed one more coin to play and said we could make money with money. I laughed with Shure about a sports analogy that confused him. Then, I pointed out a dinosaur-themed bowling game and someone suggested buying votes to win. We talked about previous players and the game's mechanics, then watched Shure throw the ball, exclaiming ""Awesome."" I clapped and watched the screen, waiting for the results, then Jake declared it was time to move on. I prompted Lucia to play the ""monster catcher,"" grabbing her water bottle and clothes for her. I gave her instructions on how to aim, counting down her attempts. Tasha threw a ball at the bowling game and I watched the group, and as Katrina and Violet prepared to play. Jake teased Shure playfully and I watched the game. After more encouragement, I called for Violet to have a turn, observing as she threw the ball down the lane. After that, I stared at a screen and then asked about nemesis. I pointed and asked about someone named Kexin, then gestured towards Alice. After someone asked how many coins, I remarked that it was one by one. Then, I showed them the screen.\n\nNext, I filmed Lucia playing an arcade game while encouraging her and watching. After cheering Lucia's turn, I started walking out, and after that, I checked the haunted house, opening the curtains and remarking about it being ""Funny."" Then, I turned to walk through a door with Alice. I watched people around a game, listening to them talk. Then, I stood behind Shure as Lucia advised him how to play. I urged us to move forward and reminisced about how easy the coin pusher games were when I was little. Tasha and I were discussing the coin-operated game and formulating a strategy. Tasha pushed it off, but it didn't fall. After we talked about the game's mechanics and I mentioned putting in more coins, I stated, ""Right, right, right."" I then walked forward, exiting through a doorway, and leaving the arcade area.
[external_current rank=3 score=10.5465 source=Alice D3 16:20:00.00-16:30:00.00] it was Day 3, and I was hanging out with Violet, Alice, Katrina, Shure, Lucia, Jake, and Tasha at the arcade. We were chatting about drinks; Violet was sharing ideas about making her own juice and adding Wangzai milk to tea. Then, Shure started playing a racing game, and there was some playful banter about him competing against himself or the computer. After a bit, Violet put on her coat, and we started to think about leaving. I was messing with my phone, logging out of WeChat and then opening another app, while hearing Jake mention ""Harvesting a lot"". We started to walk out, and then Jake mentioned that we should go back to prove that we were there. We changed our minds and walked back to the group after Jake mentioning ""there are still three more"". After that, I was messing with my phone some more, trying to make money from money. I went back to scrolling through Xiaohongshu, looking at pictures and articles, and listening to music. The others were still engrossed in arcade games, and I was just observing and scrolling through content, swiping through videos and commenting. Then after some more rounds of gaming, we were around a coin pusher; I was watching Lucia play this game. After some time, we started making our way out, but then Shure realized Jake wasn't with us. We started to walk out of the arcade and into the mall, and Katrina asked, ""Hey, why are we at MINISO with Ultraman?"" It seemed like we were heading towards the MINISO store, and Alice mentioned Barbie as we went in that direction.
[external_current rank=4 score=10.3037 source=Shure D3 16:20:00.00-16:30:00.00] Alright, Day 3 at the arcade! The first thing I did was take a good look around the massive place, just soaking it all in and getting my bearings. I found Katrina and Tasha engrossed in some games, particularly a racing one that Katrina won, feeling pretty good about it. I wandered off to explore other sections of the arcade, eventually suggesting we move on. It took a little convincing, with Lucia sounding hesitant, but we eventually agreed. I hopped on a ""Initial D Zero"" racing game for a quick go, but it was short-lived. I remember joking around about it being over, with Katrina pointing out something on the ""bed"" for decoration and Jake making some funny comments about catching up with ""this part."" We then headed out of the arcade for a bit. After that, Lucia asked about the dolls she'd grabbed, apparently quite a few. I wandered over to a coin pusher game, thinking we could ""make money to make money"", and we noticed a bowling pin inside. Then, we all followed Jake to a different game, talking about strategy, cigarette butts, and laughing. We found another game and then decided on a ""2/3"" strategy after some discussion about ""bodhisattvas"" and multiple votes. I picked up a ball and took my turn, throwing it and hearing comments about how it combined reality and the screen. I threw another ball, practiced, and heard jokes from Jake. We all took turns, Lucia had a go and I gave her some advice on the best stance. Next Tasha did very well and got a ""turkey"" on the screen, and then it was Katrina's turn. Jake was quite vocal, shouting ""More!"" It was Violet's turn so then she gave items and a ball to Lucia. We then played some more and got a good score, with everyone clapping and cheering. After that, I wandered toward another coin pusher game, I had my special card and thought I'd give it a go! We had another look at the coin game, talking about techniques. ""He, he, he puts it in"" and I put a coin in but I failed to release the coins so we moved on, with Jake commenting, ""This is the butterfly effect."" After a while, we gave up on the coin pusher, with Lucia reminiscing about how easier it used to be and claiming she ""won"". Finally, we left the arcade with Lucia, and I remember adjusting my glasses. It was so loud inside and refreshing outside, then Shure asked where Jake was and we called out for ""Hema.""
[external_current rank=5 score=8.1524 source=Jake D3 16:22:30.00-16:23:00.00] The video begins with me walking with Tasha and others in an arcade, and I'm telling Tasha that she needs one more coin to play a game, suggesting that we can make money with money. I then lead the group forward, and say we can take a seat. I am then talking to Shure, referencing a ""3-2-3 against a 3-4"" with laughter. Shure seems confused by my statement. As I continue to laugh, Lucia asks what we are talking about. The video continues as I lead the group and look to my right and state ""213"".",all_agents_current:Lucia; all_agents_current:Jake; all_agents_current:Alice; all_agents_current:Shure; all_agents_current:Katrina; self_current:Katrina; external_current:Lucia; external_current:Jake; external_current:Alice; external_current:Shure,Lucia D3 16:20:00.00-16:30:00.00; Jake D3 16:20:00.00-16:30:00.00; Alice D3 16:20:00.00-16:30:00.00; Shure D3 16:20:00.00-16:30:00.00; Katrina D3 16:30:00.00-16:40:00.00; Katrina D3 16:20:00.00-16:30:00.00; Katrina D3 16:25:30.00-16:26:00.00; Katrina D3 16:25:00.00-16:25:30.00; Katrina D3 16:29:00.00-16:29:30.00; Jake D3 16:22:30.00-16:23:00.00,all_agents_current; self_current; external_current,diagnose whether current context captions alone cover the answer evidence,partially_answerable,"evidence covers some answer keywords but may not fully support the answer; answer_hits=ball,release,she; answer_coverage=0.43; question_overlap=6",yes
