qa_packet_id,source_case_id,question_id,evidence_scope,question,answer,category,provisional_query_user,query_user_status,evidence_text,evidence_sources,evidence_time_windows,evidence_modes,expected_use,auto_answerability_draft,auto_answerability_reason,needs_user_check
ESQP_CUR_010,HISTV1_010,455,current_only,"During the cleaning sequence, whose idea was it to avoid cooking at home in the future?",Tasha suggested it because no one wants to do the dishes.,task_coordination,UNKNOWN,unknown,"[all_agents_current rank=1 score=14.4909 source=Shure D2 21:04:30.00-21:05:00.00] the video captures a conversation where Katrina is discussing the intensity of studying during final exam week and the experimental class she was in, noting the high recommendation rate of 40% and her own luck in getting in despite her low GPA. I then take out my phone and start using it as Katrina continues to explain that no one applied to the class the year she got in. During this conversation, Tasha is cleaning up the table, and Alice is moving items toward the kitchen, later asking, ""Whose are these two? Still drinking?"". Throughout the latter half of the video, I am primarily focused on my phone, while Alice unpacks a white plastic bag next to a dining table set with a small gas stove and other cooking utensils, while others are next to her.
[all_agents_current rank=2 score=8.1491 source=Katrina D2 21:04:30.00-21:05:00.00] I start by wiping the orange table with a tissue, referencing ""Katrina: Like those who study intensely during finals week."" I elaborate on our class's high guarantee rate, stating ""Katrina: Mainly because our class... Our class has a high guarantee rate, 40% guaranteed admission rate,"" all while still cleaning the table with a paper. I then dispose of the trash into a garbage bag. Alice picks up the trash box and turns around. I walk forward, then turn around, noticing Shure. I tell Shure, ""Katrina: And we were really lucky. Generally, our experimental class in our year...,"" continuing to walk forward and talk to him. I raise my hand, and Shure takes the phone from me. I advise him, ""Katrina: You need to compete, compete during the freshman year division."" I turn around, spot Tasha, and mention, ""Katrina: And then our year..."" I place the bag on the table and share, ""Katrina: That year, no one applied, did you know?"" I then pick up a box and place it into the trash bag, saying, ""Katrina: And then my GPA was so low but I still got in. And then I got a guaranteed spot for grad school."" I stuff the box further into the garbage bag. Alice then speaks, asking, ""Alice: Whose are these two? Are you still drinking?"" as she picks up two bottles of drinks.
[all_agents_current rank=3 score=8.1441 source=Alice D2 21:04:30.00-21:05:00.00] I start by cleaning up the trash on the table while Katrina is talking about things that scare you ""Katrina: You know, the kind that scares you"" ""Katrina: Like during finals week"", ""Katrina: Mainly because our class..."" ""Katrina: Our class had a high rate of postgraduate recommendations."". Then I use a tissue to wipe dirt from the table as Alice says ""Alice: Can't fit anymore."". I then pick up an ingredient box while Katrina says ""Katrina: And we were really lucky."" Looking around, Katrina mentions ""Katrina: Usually, this experimental class in our grade..."" before I begin walking towards the kitchen area, hearing ""Katrina: It requires competition"" and ""Katrina: You have to compete to get in during freshman year."". I noticed the garbage bag above the sink is full. ""Alice: There's no more bags left."". I walk back towards the table as Katrina says ""Katrina: That year no one applied, you know?"" and Alice repeats ""Alice: There's no more bags left."". Tasha is tidying dishes on the table. ""Katrina: My GPA was so low, but I still got in."" and ""Katrina: And then I got the postgraduate recommendation."". Katrina is preparing the ingredient box. She throws it into the trash bag. I have two cans in my hands as Alice asks ""Alice: Whose are these two?"" and ""Alice: Are you still drinking?"". Tasha responds, ""Tasha: Seems like no one is."". Alice says ""Alice: Then I'll dump it.""
[all_agents_current rank=4 score=7.7144 source=Jake D2 21:10:00.00-21:20:00.00] I started out at the kitchen sink, busy with the dishes. I was scrubbing bowls, rinsing them, and setting them aside. Lucia even brought me a dirty dish, adding to the pile. Tasha made me make a bowl of water for her to drink out of. I then moved on to chopsticks, washing them meticulously, and then started on a spoon when someone told me to put the vinegar down. There was some chaos when Lucia splashed water while cleaning and later Tasha commented on how greasy the spoon was. I was washing slowly, even after someone suggested I get a dishwasher, all while hearing comments about being a ""dishwasher"" myself. Jake brought the point home when I washed and handed Tasha chopsticks, and she was like, ""Those chopsticks have not been cleaned at all."". Clearly, my dishwashing wasn't up to par. After getting annoyed I decided to go wash my hands in the bathroom. I scrubbed thoroughly with soap, then went to the living room where Choiszt and others were hanging out, urging them to tidy up the living room and my room. I then started cleaning up the living room and looking for things to throw away. I gave instructions about sweeping, noting that it's hard to see at night. I stepped into my room to start cleaning it by making my bed, putting a pillow in the corner, and organizing blankets. Jake kept commenting on my folding method and whether or not he wanted the blanket. Finally I got some boxes and started putting things in them, like chargers and other small items. I put things away so my room would be clean. It was a real decluttering marathon!
[all_agents_current rank=5 score=7.4963 source=Tasha D2 21:04:30.00-21:05:00.00] I start by cleaning a kitchen sink with a metal strainer. Next, I move to a table and begin talking about studying intensely during finals week. I glance at my hand as I talk about my class having a high rate of grad school admissions. I walk to the side of the table. I place two cans on the table, followed by a bottle. I set a small box down as well. I move a small bowl forward slightly. Alice asks if there is another bag, and Tasha responds, ""Seems like that's it"". After this, I walk to the other side of the table. Alice asks ""Whose are these?"" and then she asks ""Are we still drinking?"", Tasha follows up with ""Seems like nobody's drinking anymore."" and Alice says that she will dump it.",all_agents_current:Shure; all_agents_current:Katrina; all_agents_current:Alice; all_agents_current:Jake; all_agents_current:Tasha,Shure D2 21:04:30.00-21:05:00.00; Katrina D2 21:04:30.00-21:05:00.00; Alice D2 21:04:30.00-21:05:00.00; Jake D2 21:10:00.00-21:20:00.00; Tasha D2 21:04:30.00-21:05:00.00,all_agents_current,diagnose whether current context captions alone cover the answer evidence,likely_answerable,"evidence covers most answer keywords and overlaps with the question context; answer_hits=dish,one,suggest,tasha; answer_coverage=0.80; question_overlap=3",yes
ESQP_CUR_011,HISTV1_011,475,current_only,What did Tasha propose when organizing the gift exchange task?,To taste the drinks after sorting the cups.,task_coordination,Tasha,inferred_weak,"[all_agents_current rank=1 score=9.8367 source=Alice D3 11:30:00.00-11:40:00.00] it's Day 3, and I was mostly just chilling in the living room, completely engrossed in my phone, browsing Xiaohongshu. I started by looking at WeChat but quickly moved to Xiaohongshu and spent what felt like forever scrolling through various posts, comments, and even a tutorial on making a thousand paper cranes. I remember being particularly amused by some of the content; I even showed Lucia some weird recommendations and confessed that I felt awkward after clicking on them. Shure was constantly moving around, carrying bags, laptops, and cups, and organizing things while I was glued to my phone. Tasha arrived with some bags, and everyone was milling about the table. At some point, Violet suggested we head out, and Lucia mentioned gathering gifts. This sparked some conversation about gifts and tasting drinks on the table with the flowers and other items. I overheard a funny exchange between Shure and Katrina about not being able to taste anything, so they needed to rinse their mouths. After a bit of preparation, including putting on my glasses and grabbing a gift box, Tasha told me to go upstairs and see what was happening. So, I picked up my phone and power bank, and as I was about to head out, I adjusted some flowers to make Tasha happy. I started moving toward the stairs and when I looked up, I saw Violet and we greeted each other as she came down to the first floor. It felt like a calm but busy time.
[all_agents_current rank=2 score=9.5946 source=Lucia D3 11:38:30.00-11:39:00.00] Alright, here's what I did. I started by opening the network on my phone, then heard Tasha say, ""Let's go."" I returned to the page on my phone and resent something. I saw Alice get up and leave. After looking up briefly, I resumed playing on my phone. Shure then announced, ""Oh, oh, we have an activity,"" and placed takeout on a chair. I walked over to where Shure was with my phone still in hand, observing them talking amongst themselves. Shure then asked, ""Is there a gift exchange activity too?"" before she and Violet moved to the other side of the table. Continuing to play on my phone, I remained in the living room as Violet chatted with Katrina and Shure near the coffee table. Tasha said, ""Ah, not yet. Ah, okay,"" followed by Shure responding with ""Okay."" Katrina then mentioned, ""Tasting drinks,"" after which the three of them, Katrina, Shure, and Violet, walked towards the staircase, prompting Shure to exclaim, ""Oh no, I'm done for.""
[all_agents_current rank=3 score=7.8029 source=Katrina D3 11:38:30.00-11:39:00.00] where I am working on my laptop, I hear Tasha say, ""Let's go."" Someone walks into my view. Lucia then says, ""Grab the gift and let's go,"" and I observe everyone standing up, which leads me to believe an event is about to take place. Shure confirms this by exclaiming, ""Oh, oh, we have an event."" Shure then asks, ""There's also a gift exchange, right?"" At this point, I raise my head up from my work and stand up myself. Shure continues by asking, ""Should we bring the gift up?"" I then take a sip of water from a glass or bottle nearby. Violet responds with, ""Ah, not for now. Ah, okay."" I then pick up my phone. I then turn around to look toward what appears to be an entrance hall. Shure acknowledges with an ""Okay."" I then walk towards the entrance hall. Finally, Katrina says, ""Taste the drink,"" and Shure declines with ""Oh no.""
[all_agents_current rank=4 score=6.5686 source=Jake D3 11:32:30.00-11:33:00.00] I begin by using the touchpad to operate my laptop, continuing with the task at hand. I then stand up and bend down briefly, appearing to observe the computer's status. After standing again, I turn and walk towards the stairwell. I take out my phone and initiate a text message exchange. My message reads, ""Shure: Do you offer English writing services?"". As I begin descending the stairs, I receive a reply, ""Tasha: I don't offer English writing services."" Following this, I open the timer application on my phone. I then send another message, ""Shure: Then you're in trouble."" Continuing my descent, I read the response, ""Tasha: Just write it yourself."" To which I reply, ""Shure: I'm submitting it on the 24th, and..."" Reaching the bottom of the stairs, I turn left and enter another room where I see other colleagues.
[all_agents_current rank=5 score=5.9576 source=Shure D3 11:38:30.00-11:39:00.00] I'm in a room where Tasha says, ""Let's go,"" but Violet and others continue eating pizza at the table. I rest my hand on the table and glance over at them. I hear Shure say, ""Oh, oh, we have an event,"" and I notice Alice. Shure continues, asking, ""And we have a gift exchange event, right?"" I begin walking forward, continuing my movement through the room, eventually walking up to Katrina. I ask, ""Should we bring the gifts up?"" Katrina then gets up. I start chatting with Violet, hearing Tasha respond with, ""Ah, no need yet. Ah, okay."" I then notice Violet and proceed to adjust my glasses twice. After that, I walk towards the door. Shure says, ""Alright."" I continue to walk outside, and then I exclaim, ""Oh no.""
[self_current rank=1 score=0.9041 source=Tasha D3 11:40:00.00-11:50:00.00] I'm sitting at a table with Jake, Lucia, Shure, Alice, Tasha and Katrina, engaged in a water-tasting challenge, attempting to distinguish between different brands of mineral water. I start by tasting a glass, identifying it as mineral water. Frustrated by the subtle differences, I sigh, declaring that I should be able to tell them apart without even drinking. I spill some water and ask Jake for a napkin. We then try to figure out how to number the cups, debating the best way to label them, exploring using pens and writing letters like ABCDE or even just numbers. We briefly consider eco-friendly solutions and I try tasting the waters again, even feeling the bottles to discern temperature differences, but I struggle to differentiate them, with encouragement and lighthearted teasing from the others who urge me to keep trying. I ask about a whiteboard marker and eventually start writing letters, first a ""D"" and then an ""E"" on a power bank that I must be using as a kind of answer sheet. I continue to taste waters, trying to discern the differences. Katrina seems to be giving up, joking about writing ""Yibao"" for everything, while Jake jokingly threatens to check if her ""Yibao"" is correct. Discouraged, I say ""I don't get it,"" and suggest reversing the order, then follow Jake's suggestion to use the letters 1, 2, 1, 2, 3, 4, 5, 6. Finally, I start taking notes on a piece of paper, writing down numbers as everyone turns in their answers.
[external_current rank=1 score=9.7828 source=Alice D3 11:30:00.00-11:40:00.00] it's Day 3, and I was mostly just chilling in the living room, completely engrossed in my phone, browsing Xiaohongshu. I started by looking at WeChat but quickly moved to Xiaohongshu and spent what felt like forever scrolling through various posts, comments, and even a tutorial on making a thousand paper cranes. I remember being particularly amused by some of the content; I even showed Lucia some weird recommendations and confessed that I felt awkward after clicking on them. Shure was constantly moving around, carrying bags, laptops, and cups, and organizing things while I was glued to my phone. Tasha arrived with some bags, and everyone was milling about the table. At some point, Violet suggested we head out, and Lucia mentioned gathering gifts. This sparked some conversation about gifts and tasting drinks on the table with the flowers and other items. I overheard a funny exchange between Shure and Katrina about not being able to taste anything, so they needed to rinse their mouths. After a bit of preparation, including putting on my glasses and grabbing a gift box, Tasha told me to go upstairs and see what was happening. So, I picked up my phone and power bank, and as I was about to head out, I adjusted some flowers to make Tasha happy. I started moving toward the stairs and when I looked up, I saw Violet and we greeted each other as she came down to the first floor. It felt like a calm but busy time.
[external_current rank=2 score=9.5491 source=Lucia D3 11:38:30.00-11:39:00.00] Alright, here's what I did. I started by opening the network on my phone, then heard Tasha say, ""Let's go."" I returned to the page on my phone and resent something. I saw Alice get up and leave. After looking up briefly, I resumed playing on my phone. Shure then announced, ""Oh, oh, we have an activity,"" and placed takeout on a chair. I walked over to where Shure was with my phone still in hand, observing them talking amongst themselves. Shure then asked, ""Is there a gift exchange activity too?"" before she and Violet moved to the other side of the table. Continuing to play on my phone, I remained in the living room as Violet chatted with Katrina and Shure near the coffee table. Tasha said, ""Ah, not yet. Ah, okay,"" followed by Shure responding with ""Okay."" Katrina then mentioned, ""Tasting drinks,"" after which the three of them, Katrina, Shure, and Violet, walked towards the staircase, prompting Shure to exclaim, ""Oh no, I'm done for.""
[external_current rank=3 score=7.7637 source=Katrina D3 11:38:30.00-11:39:00.00] where I am working on my laptop, I hear Tasha say, ""Let's go."" Someone walks into my view. Lucia then says, ""Grab the gift and let's go,"" and I observe everyone standing up, which leads me to believe an event is about to take place. Shure confirms this by exclaiming, ""Oh, oh, we have an event."" Shure then asks, ""There's also a gift exchange, right?"" At this point, I raise my head up from my work and stand up myself. Shure continues by asking, ""Should we bring the gift up?"" I then take a sip of water from a glass or bottle nearby. Violet responds with, ""Ah, not for now. Ah, okay."" I then pick up my phone. I then turn around to look toward what appears to be an entrance hall. Shure acknowledges with an ""Okay."" I then walk towards the entrance hall. Finally, Katrina says, ""Taste the drink,"" and Shure declines with ""Oh no.""
[external_current rank=4 score=6.5490 source=Jake D3 11:32:30.00-11:33:00.00] I begin by using the touchpad to operate my laptop, continuing with the task at hand. I then stand up and bend down briefly, appearing to observe the computer's status. After standing again, I turn and walk towards the stairwell. I take out my phone and initiate a text message exchange. My message reads, ""Shure: Do you offer English writing services?"". As I begin descending the stairs, I receive a reply, ""Tasha: I don't offer English writing services."" Following this, I open the timer application on my phone. I then send another message, ""Shure: Then you're in trouble."" Continuing my descent, I read the response, ""Tasha: Just write it yourself."" To which I reply, ""Shure: I'm submitting it on the 24th, and..."" Reaching the bottom of the stairs, I turn left and enter another room where I see other colleagues.
[external_current rank=5 score=5.9392 source=Shure D3 11:38:30.00-11:39:00.00] I'm in a room where Tasha says, ""Let's go,"" but Violet and others continue eating pizza at the table. I rest my hand on the table and glance over at them. I hear Shure say, ""Oh, oh, we have an event,"" and I notice Alice. Shure continues, asking, ""And we have a gift exchange event, right?"" I begin walking forward, continuing my movement through the room, eventually walking up to Katrina. I ask, ""Should we bring the gifts up?"" Katrina then gets up. I start chatting with Violet, hearing Tasha respond with, ""Ah, no need yet. Ah, okay."" I then notice Violet and proceed to adjust my glasses twice. After that, I walk towards the door. Shure says, ""Alright."" I continue to walk outside, and then I exclaim, ""Oh no.""",all_agents_current:Alice; all_agents_current:Lucia; all_agents_current:Katrina; all_agents_current:Jake; all_agents_current:Shure; self_current:Tasha; external_current:Alice; external_current:Lucia; external_current:Katrina; external_current:Jake; external_current:Shure,Alice D3 11:30:00.00-11:40:00.00; Lucia D3 11:38:30.00-11:39:00.00; Katrina D3 11:38:30.00-11:39:00.00; Jake D3 11:32:30.00-11:33:00.00; Shure D3 11:38:30.00-11:39:00.00; Tasha D3 11:40:00.00-11:50:00.00,all_agents_current; self_current; external_current,diagnose whether current context captions alone cover the answer evidence,likely_answerable,"evidence covers most answer keywords and overlaps with the question context; answer_hits=cups,drink,taste; answer_coverage=0.75; question_overlap=5",yes
