case_id,question_id,question,answer,category,provisional_query_user,query_user_status,current_only_answerability,historical_only_answerability,current_plus_historical_answerability,current_to_current_plus_gain,likely_case_bucket,best_evidence_scope,best_evidence_summary,recommended_keep_for_next_stage,reason
HISTV1_001,1402,Who used the cabinet the most before 1PM on DAY4?,Shure,environmental_interaction,UNKNOWN,unknown,unclear,not_answerable,unclear,no,not_self_first_or_unclear,current_plus_historical,"[all_agents_current rank=1 score=6.7647 source=Shure D4 11:25:00.00-11:25:30.00] I started by picking up a spatula and proceeded to place slices of bread together in a pan that was on the stovetop. Subsequently, I placed chopsticks into a nearby bowl, temporarily setting them aside. Switching hands, I then used the spatula with my other hand, pressing down on the bread slices in the pan. I pressed the bread slice with the spatula twice. Next, I used the spatula to flip one of the slices of bread over in the pan. I placed the spatula again on top of the bread slices to press it. After that, I briefly turned to my left, catching sight of Luc...",no,"current=unclear (global/statistical/temporal question with partial lexical overlap; caption coverage may be too local) | history=not_answerable (global/statistical/temporal question and this evidence scope does not expose enough answer-related coverage) | current+history=unclear (global/statistical/temporal question with partial lexical overlap; caption coverage may be too local) | gain=no | bucket=not_self_first_or_unclear | global/statistical/temporal question requires conservative answerability | query_user is UNKNOWN, so self-first interpretation remains provisional"
HISTV1_002,1527,Who used the mirror the most after 6PM on DAY4?,Shure,environmental_interaction,UNKNOWN,unknown,unclear,partially_answerable,partially_answerable,yes,not_self_first_or_unclear,current_plus_historical,"[all_agents_current rank=1 score=8.2110 source=Shure D4 18:29:00.00-18:29:30.00] I begin by adjusting my glasses, after which I hear Jake state, ""I purposely opened my eyes wide."" I proceed to walk towards the kitchen area, eventually reaching the stove. I then turn to my left, and I hear Lucia say, ""Hmm,"" followed by, ""Because it's hard to draft,"" and Jake adds, ""And big eyes."" I take a bite of a roasted sweet potato, and Jake interjects with ""Oh."" I walk forward, and Lucia suggests, ""So just use that expression,"" while Alice walks back towards his room. I turn to my right and hear Lucia say, ""Emoji mode,"" as she continues speaking. Havin...",no,"current=unclear (global/statistical/temporal question with partial lexical overlap; caption coverage may be too local) | history=partially_answerable (global/statistical/temporal question; captions mention answer-related terms but may not cover enough events to verify the full comparison/order) | current+history=partially_answerable (global/statistical/temporal question; captions mention answer-related terms but may not cover enough events to verify the full comparison/order) | gain=yes | bucket=not_self_first_or_unclear | global/statistical/temporal question requires conservative answerability | query_user is UNKNOWN, so self-first interpretation remains provisional"
HISTV1_003,1528,Who used the mirror the most after 6PM on DAY6?,Katrina,environmental_interaction,UNKNOWN,unknown,partially_answerable,not_answerable,partially_answerable,no,not_self_first_or_unclear,current_plus_historical,"[all_agents_current rank=1 score=10.7670 source=Lucia D6 19:53:30.00-19:54:00.00] The scene opens with me sitting amongst a group of people, most of whom are facing towards a projector screen at the front of the room. It’s DAY6, as indicated in the upper left corner of the frame. Jake adjusts his posture, while Violet sways in the background. My primary focus throughout the duration of the video is on my phone, which I am holding in my hand. The screen displays text in what appears to be Chinese. I continue to scroll and look at the content on my phone. I swipe up on the screen to navigate through the content displayed. The overall atmosph...",no,"current=partially_answerable (global/statistical/temporal question; captions mention answer-related terms but may not cover enough events to verify the full comparison/order) | history=not_answerable (global/statistical/temporal question and this evidence scope does not expose enough answer-related coverage) | current+history=partially_answerable (global/statistical/temporal question; captions mention answer-related terms but may not cover enough events to verify the full comparison/order) | gain=no | bucket=not_self_first_or_unclear | global/statistical/temporal question requires conservative answerability | query_user is UNKNOWN, so self-first interpretation remains provisional"
HISTV1_004,1564,Who used the piano the most after 6PM on DAY6?,Nicous,environmental_interaction,UNKNOWN,unknown,partially_answerable,unclear,partially_answerable,no,not_self_first_or_unclear,current_plus_historical,"[all_agents_current rank=1 score=10.9944 source=Lucia D6 19:53:30.00-19:54:00.00] The scene opens with me sitting amongst a group of people, most of whom are facing towards a projector screen at the front of the room. It’s DAY6, as indicated in the upper left corner of the frame. Jake adjusts his posture, while Violet sways in the background. My primary focus throughout the duration of the video is on my phone, which I am holding in my hand. The screen displays text in what appears to be Chinese. I continue to scroll and look at the content on my phone. I swipe up on the screen to navigate through the content displayed. The overall atmosph...",no,"current=partially_answerable (global/statistical/temporal question; captions mention answer-related terms but may not cover enough events to verify the full comparison/order) | history=unclear (global/statistical/temporal question with partial lexical overlap; caption coverage may be too local) | current+history=partially_answerable (global/statistical/temporal question; captions mention answer-related terms but may not cover enough events to verify the full comparison/order) | gain=no | bucket=not_self_first_or_unclear | global/statistical/temporal question requires conservative answerability | query_user is UNKNOWN, so self-first interpretation remains provisional"
HISTV1_005,1577,When was the first time power bank was used after 6PM on DAY3?,6 PM,environmental_interaction,UNKNOWN,unknown,not_answerable,not_answerable,not_answerable,no,not_self_first_or_unclear,current_plus_historical,"[all_agents_current rank=1 score=19.8615 source=Jake D3 19:39:30.00-19:40:00.00] I started by connecting the first power bank to the camera's power cable, then turned the power bank on. Next, I unplugged the data cable connected to the first power bank. Following that, I plugged the data cable into the second power bank. After ensuring the connection, I looked up briefly to visually check the camera's status, presumably to confirm it was receiving power. I then turned to my right and began walking forward. I continued walking straight, eventually approaching the corner of the kitchen. I then walked towards the other room. [all_agents_curre...",no,"current=not_answerable (evidence does not contain enough answer-relevant caption content) | history=not_answerable (evidence does not contain enough answer-relevant caption content) | current+history=not_answerable (evidence does not contain enough answer-relevant caption content) | gain=no | bucket=not_self_first_or_unclear | query_user is UNKNOWN, so self-first interpretation remains provisional"
HISTV1_006,1579,Who used the power bank the most after 6PM on DAY3?,Jake,environmental_interaction,UNKNOWN,unknown,partially_answerable,partially_answerable,partially_answerable,no,not_self_first_or_unclear,current_plus_historical,"[all_agents_current rank=1 score=17.3238 source=Jake D3 18:15:30.00-18:16:00.00] I'm moving a power bank around on a somewhat cluttered table. I first attempt to plug it into the computer, but the initial orientation is incorrect, so I rotate it and try again, still unsuccessfully. I rotate it a second time and finally manage to insert the power bank's connector into the port. Then I pick up my glasses, but the power cord gets tangled, so I lift it up, set it back down briefly, and then pick it up again. Finally, I place the power bank on the table, acknowledging that it isn't in the most ideal spot. [all_agents_current rank=2 score=16.660...",no,"current=partially_answerable (global/statistical/temporal question; captions mention answer-related terms but may not cover enough events to verify the full comparison/order) | history=partially_answerable (global/statistical/temporal question; captions mention answer-related terms but may not cover enough events to verify the full comparison/order) | current+history=partially_answerable (global/statistical/temporal question; captions mention answer-related terms but may not cover enough events to verify the full comparison/order) | gain=no | bucket=not_self_first_or_unclear | global/statistical/temporal question requires conservative answerability | query_user is UNKNOWN, so self-first interpretation remains provisional"
HISTV1_007,729,What collaborative task did Jack initiate when it was time for the next song during the rehearsal?,He used the microphone to organize the singing order.,task_coordination,UNKNOWN,unknown,likely_answerable,unclear,likely_answerable,no,current_sufficient,current_plus_historical,"[all_agents_current rank=1 score=13.4751 source=Katrina D6 19:50:00.00-20:00:00.00] I started the evening in my yellow-lit bedroom, singing ""Sunny Day"" with Shure accompanying me on guitar. I paused recording briefly when Nicous was looking for something, but then resumed to capture Shure's performance. After that song, we discussed what to play next, suggestions flying about like ""Add a piano,"" ""Quicksand,"" and ""New Boy."" Katrina insisted we play whatever we wanted. Amidst the chatter, I grabbed my water, and we decided on a D major chord progression of Canon; I handed the mic to Shure. I joked about it being ""very sophisticated."" Shure b...",unclear,"current=likely_answerable (evidence covers most answer keywords and overlaps with the question context) | history=unclear (evidence has lexical overlap but does not clearly support the answer) | current+history=likely_answerable (evidence covers most answer keywords and overlaps with the question context) | gain=no | bucket=current_sufficient | query_user is UNKNOWN, so self-first interpretation remains provisional"
HISTV1_008,831,"In cleaning coordination, what sequence did the participants use to ensure cleaning and follow-through in different events?","They completed first-floor cleaning before planning, and later followed Tasha’s proposed steps while Jake prepared materials.",task_coordination,UNKNOWN,unknown,likely_answerable,likely_answerable,likely_answerable,no,not_self_first_or_unclear,current_plus_historical,"[all_agents_current rank=1 score=8.7208 source=Alice D2 21:50:00.00-22:00:00.00] I had just finished washing the pot, noticing how much cleaner it was after scrubbing with the steel wool. I poured the water out and even refilled it a couple of times to make sure it was spotless. I was so focused on cleaning that my hair kept getting in the way! After putting the pot away, I noticed I had made a bit of a mess on the table with water and some oil. ""Oh no,"" I muttered to myself before grabbing some wet wipes and really cleaning it up, making sure to get every last bit of residue and any stray water droplets. I squeezed out the excess water fr...",no,"current=likely_answerable (evidence covers key answer terms and strongly overlaps with the question context) | history=likely_answerable (evidence covers key answer terms and strongly overlaps with the question context) | current+history=likely_answerable (evidence covers most answer keywords and overlaps with the question context) | gain=no | bucket=not_self_first_or_unclear | query_user is UNKNOWN, so self-first interpretation remains provisional"
HISTV1_009,735,Who helped finalize the arrangement for ensuring everyone accessed what they needed during cleanup tasks after performance event?,Jake by confirming they’d help delete unnecessary data,task_coordination,UNKNOWN,unknown,partially_answerable,unclear,likely_answerable,yes,not_self_first_or_unclear,current_plus_historical,"[all_agents_current rank=1 score=7.9063 source=Lucia D6 21:06:30.00-21:07:00.00] I am at what seems to be an outdoor event. I start by glancing briefly at Alice, and then turn my head to look at her again. Alice then also turns her head, taking a look around the space. Shortly after, I direct my gaze towards Jake. At that moment, a friend of Alice's approaches the group, walking behind Alice. I then engage in conversation with them, speaking to Alice and her friend in Shaanxi dialect, and I continue to converse with them for the remainder of the video. [all_agents_current rank=2 score=7.4860 source=Jake D6 21:04:30.00-21:05:00.00] The vide...",no,"current=partially_answerable (evidence covers some answer keywords but may not fully support the answer) | history=unclear (evidence has lexical overlap but does not clearly support the answer) | current+history=likely_answerable (evidence covers key answer terms and strongly overlaps with the question context) | gain=yes | bucket=not_self_first_or_unclear | query_user is UNKNOWN, so self-first interpretation remains provisional"
HISTV1_010,455,"During the cleaning sequence, whose idea was it to avoid cooking at home in the future?",Tasha suggested it because no one wants to do the dishes.,task_coordination,UNKNOWN,unknown,likely_answerable,likely_answerable,likely_answerable,no,not_self_first_or_unclear,current_plus_historical,"[all_agents_current rank=1 score=14.4909 source=Shure D2 21:04:30.00-21:05:00.00] the video captures a conversation where Katrina is discussing the intensity of studying during final exam week and the experimental class she was in, noting the high recommendation rate of 40% and her own luck in getting in despite her low GPA. I then take out my phone and start using it as Katrina continues to explain that no one applied to the class the year she got in. During this conversation, Tasha is cleaning up the table, and Alice is moving items toward the kitchen, later asking, ""Whose are these two? Still drinking?"". Throughout the latter half of th...",no,"current=likely_answerable (evidence covers most answer keywords and overlaps with the question context) | history=likely_answerable (evidence covers key answer terms and strongly overlaps with the question context) | current+history=likely_answerable (evidence covers most answer keywords and overlaps with the question context) | gain=no | bucket=not_self_first_or_unclear | query_user is UNKNOWN, so self-first interpretation remains provisional"
HISTV1_011,475,What did Tasha propose when organizing the gift exchange task?,To taste the drinks after sorting the cups.,task_coordination,Tasha,inferred_weak,likely_answerable,unclear,likely_answerable,no,current_sufficient,current_plus_historical,"[all_agents_current rank=1 score=9.8367 source=Alice D3 11:30:00.00-11:40:00.00] it's Day 3, and I was mostly just chilling in the living room, completely engrossed in my phone, browsing Xiaohongshu. I started by looking at WeChat but quickly moved to Xiaohongshu and spent what felt like forever scrolling through various posts, comments, and even a tutorial on making a thousand paper cranes. I remember being particularly amused by some of the content; I even showed Lucia some weird recommendations and confessed that I felt awkward after clicking on them. Shure was constantly moving around, carrying bags, laptops, and cups, and organizing t...",unclear,current=likely_answerable (evidence covers most answer keywords and overlaps with the question context) | history=unclear (evidence has lexical overlap but does not clearly support the answer) | current+history=likely_answerable (evidence covers most answer keywords and overlaps with the question context) | gain=no | bucket=current_sufficient
HISTV1_012,487,"Alright, so if we're talking about how everyone managed the game tokens at the arcade, how was the last coin at one point planned to be used?",It was given to Jake for him to decide what to do with it.,task_coordination,UNKNOWN,unknown,likely_answerable,likely_answerable,likely_answerable,no,not_self_first_or_unclear,current_plus_historical,"[all_agents_current rank=1 score=18.7206 source=Shure D3 16:14:30.00-16:15:00.00] I stand up from playing the game as Katrina says, ""Wow"". Then she bends down to pick up her phone, and I hear Shure say, ""Dropped my phone."" I see everyone coming over towards the game console. I then take a sip of water, saying, ""Win,"" and point at the game console screen. Lucia asks, ""Anyone else wants to play?"". I take another sip of water. Lucia continues to speak. Katrina mentions, ""Only one person can play."" Shure asks, ""How many tokens do we have left?"". Lucia then says, ""I have some, I can start another game."" I look directly at Lucia as she says, ""So...",no,"current=likely_answerable (evidence covers key answer terms and strongly overlaps with the question context) | history=likely_answerable (evidence covers key answer terms and strongly overlaps with the question context) | current+history=likely_answerable (evidence covers key answer terms and strongly overlaps with the question context) | gain=no | bucket=not_self_first_or_unclear | query_user is UNKNOWN, so self-first interpretation remains provisional"
HISTV1_013,1113,"Which of the following happened first? A) Lucia oversaw reimbursements and dismantled a cabinet before departure planning B) Alice coordinated takeout ordering and kitchen prep after organizing groceries, C) Shure managed recording setups while the group planned meals and budgets, D) Katrina led themed room planning and wrapped up the session, E) Jake finalized plans for the evening BBQ and post-dinner activities,",E,temporal_reasoning,UNKNOWN,unknown,partially_answerable,partially_answerable,partially_answerable,unclear-but-promising,not_self_first_or_unclear,current_plus_historical,"[all_agents_current rank=1 score=48.9089 source=Shure D1 12:12:00.00-12:12:30.00] I am writing on the whiteboard, planning activities for the next few days. I began by writing ""Dinner 5:30 above,"" indicating the planned dinner time. Then, I wrote ""Big Pizza, BBQ,"" while Shure says, ""After 5:30"", and then ""Around 5:30, yeah"". Other people said ""Competition"", ""A bow"", and ""The first pizza also has BBQ."" I continue to add details to the board, writing little by little to specify ""BBQ"" for the pizza. [all_agents_current rank=2 score=38.8914 source=Shure D1 12:10:00.00-12:10:30.00] the video starts with me stating, ""Yeah, that's it,"" followed b...",no,"current=partially_answerable (global/statistical/temporal question; captions mention answer-related terms but may not cover enough events to verify the full comparison/order) | history=partially_answerable (global/statistical/temporal question; captions mention answer-related terms but may not cover enough events to verify the full comparison/order) | current+history=partially_answerable (global/statistical/temporal question; captions mention answer-related terms but may not cover enough events to verify the full comparison/order) | gain=unclear-but-promising | bucket=not_self_first_or_unclear | global/statistical/temporal question requires conservative answerability | query_user is UNKNOWN, so self-first interpretation remains provisional"
HISTV1_014,1161,"Which of the following happened first? A) Katrina checked messages on WeChat after discussing food, B) Alice filled a bottle with water in the bathroom, C) Jake used a hole punch to make holes in a bag D) Lucia drank water while watching Shure and Katrina, E) Tasha washed dishes and organized bowls at the sink,",B,temporal_reasoning,UNKNOWN,unknown,partially_answerable,partially_answerable,partially_answerable,no,not_self_first_or_unclear,current_plus_historical,"[all_agents_current rank=1 score=31.9020 source=Alice D1 12:10:00.00-12:20:00.00] After finishing the showerhead repair, I admired myself in the mirror, flashed a peace sign, and double-checked my glasses before turning my attention to the trash can, which was filling with water from the shower. I adjusted my skirt and meticulously worked, detaching and reattaching the showerhead, using my hand to test the water temperature and making sure the trash can filled properly. During the process, I took a brief glance at an orange object on the wall before turning my attention back to filling the trash can. I then emptied the water, carrying the...",no,"current=partially_answerable (global/statistical/temporal question; captions mention answer-related terms but may not cover enough events to verify the full comparison/order) | history=partially_answerable (global/statistical/temporal question; captions mention answer-related terms but may not cover enough events to verify the full comparison/order) | current+history=partially_answerable (global/statistical/temporal question; captions mention answer-related terms but may not cover enough events to verify the full comparison/order) | gain=no | bucket=not_self_first_or_unclear | global/statistical/temporal question requires conservative answerability | query_user is UNKNOWN, so self-first interpretation remains provisional"
HISTV1_015,1165,"Which of the following happened last? A) Tasha led evening cleanup and planned next day's activities, B) Lucia curated dance videos and finished sketching a cat for art, C) Katrina rehearsed music with Shure and mentored Nicous on guitar D) Alice finalized event roles and schedules for the evening program, E) Jake wrapped picnic setup and concluded filming of the gathering,",C,temporal_reasoning,UNKNOWN,unknown,unclear,partially_answerable,partially_answerable,yes,not_self_first_or_unclear,current_plus_historical,"[all_agents_current rank=1 score=31.3289 source=Tasha D1 12:12:30.00-12:13:00.00] sitting at a table with a red and white checkered tablecloth, I began searching on my phone, presumably for event planning details, as Katrina, Shure, and Lucy discuss cocktails and desserts being available. I heard Shure say, ""Yeah, like desserts and..."" and Katrina added, ""When they entered the venue."" I continued to navigate the software. Then, Jake joined in with ""What is SS?"", prompting me to briefly look toward the whiteboard where he was pointing and then at Jake himself after Shure explained the acronym with ""WS multiplied by 2"". I then exited the sof...",no,"current=unclear (global/statistical/temporal question with partial lexical overlap; caption coverage may be too local) | history=partially_answerable (global/statistical/temporal question; captions mention answer-related terms but may not cover enough events to verify the full comparison/order) | current+history=partially_answerable (global/statistical/temporal question; captions mention answer-related terms but may not cover enough events to verify the full comparison/order) | gain=yes | bucket=not_self_first_or_unclear | global/statistical/temporal question requires conservative answerability | query_user is UNKNOWN, so self-first interpretation remains provisional"
HISTV1_016,1186,"Which is the correct sequence of events? A) Lucia helped finalize an Earth Day-themed coin-and-auction event plan, B) Alice guided park route decisions after checking the tourist map and discussing vending machine issues, C) Jake went shopping at a supermarket with a problematic cart and browsed beverages and housewares",A-B-C,temporal_reasoning,UNKNOWN,unknown,unclear,unclear,unclear,no,not_self_first_or_unclear,current_plus_historical,"[all_agents_current rank=1 score=25.5519 source=Katrina D1 11:40:00.00-11:50:00.00] I'm sitting in a room with Lucy, Shure, Jake, Katrina, Tasha, and Alice, engaged in a collaborative planning session, which seems to revolve around an Earth Day-themed event. Initially, Lucy's describing the concept of making cardboard dogs of varying complexities for decoration, sparking ideas and notes from Shure on the whiteboard. Lucia then suggests using cardboard as an eco-friendly material, and proposes potentially creating a short play or film. We jokingly brainstormed some backward spellings of names, and the conversation shifts towards gathering p...",no,"current=unclear (global/statistical/temporal question with partial lexical overlap; caption coverage may be too local) | history=unclear (global/statistical/temporal question with partial lexical overlap; caption coverage may be too local) | current+history=unclear (global/statistical/temporal question with partial lexical overlap; caption coverage may be too local) | gain=no | bucket=not_self_first_or_unclear | global/statistical/temporal question requires conservative answerability | query_user is UNKNOWN, so self-first interpretation remains provisional"
