case_id,question_id,question,answer,category,provisional_query_user,query_user_status,current_only_answerability,historical_only_answerability,current_plus_historical_answerability,current_to_current_plus_gain,likely_case_bucket,best_evidence_scope,best_evidence_summary,recommended_keep_for_next_stage,reason
HISTV1_017,1360,"When Jake was walking with Nicous and Tasha carrying a package behind the houses, and Alice was listening to sad love songs and finishing a star, what was Shure doing?",Cleaning up the trash and packing it into a box while chatting with Katrina.,temporal_reasoning,UNKNOWN,unknown,likely_answerable,partially_answerable,likely_answerable,no,current_sufficient,current_plus_historical,"[all_agents_current rank=1 score=22.8822 source=Alice D6 11:36:00.00-11:36:30.00] I am listening to music, songs that describe love and I think they are very sad. I am cutting the last corner of a star. Alright, I have finished cutting out this star. I put the star on the sofa and pick up the stars. Then Alice asks, ""Are they back yet?"". Lucia replies, ""Feels like they should be back soon. But picking up packages. Yesterday, it took us an hour to get the package because we went to a lottery shop on the way."" I am listening to Lucia speak, while I notice there is also a big star. [all_agents_current rank=2 score=18.9025 source=Tasha D6 11:3...",unclear,"current=likely_answerable (evidence covers most answer keywords and overlaps with the question context) | history=partially_answerable (evidence covers some answer keywords but may not fully support the answer) | current+history=likely_answerable (evidence covers most answer keywords and overlaps with the question context) | gain=no | bucket=current_sufficient | query_user is UNKNOWN, so self-first interpretation remains provisional"
HISTV1_018,1095,"Which of the following happened last? A) Jake systematically scanned all rooms with his phone to document the space B) Tasha multitasked on her phone and instructed refrigerating dessert before the meal, C) Katrina settled on a simple upbeat dance during pancake cooking, D) Alice filmed Shure’s drum game and tried the claw machine, E) Lucia coordinated cake layering and joined the group for outdoor dining,",A,temporal_reasoning,UNKNOWN,unknown,partially_answerable,partially_answerable,partially_answerable,unclear-but-promising,not_self_first_or_unclear,current_plus_historical,"[all_agents_current rank=1 score=27.7656 source=Jake D2 10:50:00.00-11:00:00.00] I noticed a power bank lying on the floor and overheard Tasha commenting on how ""ugly"" the mixture was, mistakenly thinking it was made with cake flour when it was actually glutinous rice flour. Alice wondered what glutinous rice flour was and Katrina asked if they should bring Shyness when dancing, Tasha then chimed in with ""At home, we usually use glutinous rice flour."" I looked back at the power bank. Lucia was talking about needing things for dance practice and thought at least when they practice, everyone should bring it, and there was a continuing discus...",no,"current=partially_answerable (global/statistical/temporal question; captions mention answer-related terms but may not cover enough events to verify the full comparison/order) | history=partially_answerable (global/statistical/temporal question; captions mention answer-related terms but may not cover enough events to verify the full comparison/order) | current+history=partially_answerable (global/statistical/temporal question; captions mention answer-related terms but may not cover enough events to verify the full comparison/order) | gain=unclear-but-promising | bucket=not_self_first_or_unclear | global/statistical/temporal question requires conservative answerability | query_user is UNKNOWN, so self-first interpretation remains provisional"
HISTV1_019,2,"When Katrina helped finalize the list on the whiteboard, who seemed most actively giving her suggestions?",Lucia and Tasha,social_interaction,Katrina,inferred_weak,likely_answerable,likely_answerable,likely_answerable,no,current_sufficient,current_plus_historical,"[all_agents_current rank=1 score=10.4183 source=Tasha D1 13:55:00.00-13:55:30.00] I am holding a tablet and watching Katrina as she writes on a whiteboard. Initially, Jake and Lucia discuss the presence of lures, determining there shouldn't be any but only utensils, pots, and pans. Subsequently, Tasha lists items, including milk, light cream, eggs, starch, salt, saline, sugar, and heavy cream. I then engage in a discussion with Katrina about what we should buy, specifically regarding a small packet of milk powder. The conversation continues, with Tasha repeating ""Salt, a packet of milk powder"" as we further discuss the shopping list. I am...",unclear,current=likely_answerable (evidence covers most answer keywords and overlaps with the question context) | history=likely_answerable (evidence covers most answer keywords and overlaps with the question context) | current+history=likely_answerable (evidence covers most answer keywords and overlaps with the question context) | gain=no | bucket=current_sufficient
HISTV1_020,170,"Who helped each other find scissors, and what were the scissors used for?",Jake handed scissors to Katrina for her package and flower crafts.,social_interaction,UNKNOWN,unknown,likely_answerable,likely_answerable,likely_answerable,no,not_self_first_or_unclear,current_plus_historical,"[all_agents_current rank=1 score=11.6825 source=Katrina D4 12:26:30.00-12:27:00.00] First, I am seen cutting a flower stem with blue-handled scissors. Subsequently, I put the scissors down and hold the flower. I then reach for my phone, pick it up, and operate it to open the WeChat application. Within WeChat, I navigate through the interface by sliding. I then open the camera feature within the application. I proceed to attempt to take a photograph of the flower, adjusting the angle to find an ideal composition, but seem to be unsuccessful in initially achieving the desired framing. Finally, I take a photograph of the flower and then, I pu...",no,"current=likely_answerable (evidence covers most answer keywords and overlaps with the question context) | history=likely_answerable (evidence covers most answer keywords and overlaps with the question context) | current+history=likely_answerable (evidence covers most answer keywords and overlaps with the question context) | gain=no | bucket=not_self_first_or_unclear | query_user is UNKNOWN, so self-first interpretation remains provisional"
HISTV1_021,373,How did phone handling during food ordering differ across the situations?,"Alice first hesitated with the phone, later completed the order, while Jake refused to give his phone to Tasha.",social_interaction,UNKNOWN,unknown,likely_answerable,partially_answerable,likely_answerable,no,not_self_first_or_unclear,current_plus_historical,"[all_agents_current rank=1 score=8.6100 source=Alice D1 13:41:30.00-13:42:00.00] I am in the kitchen, placing the delivered food items, including bags and packages, next to the sink. Jake says, ""Finished ordering,"" and asks, ""How many did you order?"". I proceed to organize the items, arranging them neatly beside the sink. I then look back as Jake asks ""Really?"" Shure then says, ""Ordered a meal for two,"" confirming, ""Yeah, that was me."" I accidentally kick a bag on the floor. Turning around, I hear Shure repeat, ""I ordered a meal for two,"" followed by Jake's question, ""You ordered a meal for two by yourself?"" I then retrieve a board from th...",no,"current=likely_answerable (evidence covers most answer keywords and overlaps with the question context) | history=partially_answerable (evidence covers some answer keywords but may not fully support the answer) | current+history=likely_answerable (evidence covers most answer keywords and overlaps with the question context) | gain=no | bucket=not_self_first_or_unclear | query_user is UNKNOWN, so self-first interpretation remains provisional"
HISTV1_022,4,"Who seemed the most amused by the idea of cardboard greeters, and what was their reaction?",Alice humorously mentioned keeping all boxes just to make more dogs.,social_interaction,UNKNOWN,unknown,partially_answerable,partially_answerable,partially_answerable,no,not_self_first_or_unclear,current_plus_historical,"[all_agents_current rank=1 score=8.1807 source=Jake D1 13:50:00.00-14:00:00.00] I started out looking for a phone charger, declaring I would check the dorm for extras the next day. I found it eventually, after a bit of wandering around and listening to a conversation about the meanings of words and a debate about whether to buy rum or tequila, and the crew, who apparently had to go to class, and was now considered the ""part-time crew"". Then I got involved in cleaning up the kitchen, being directed to rinse the dishes with clean water. We were discussing orange juice, sparkling wine, and mimosa, debating flavors and alcohol content. Tasha w...",no,"current=partially_answerable (global/statistical/temporal question; captions mention answer-related terms but may not cover enough events to verify the full comparison/order) | history=partially_answerable (global/statistical/temporal question; captions mention answer-related terms but may not cover enough events to verify the full comparison/order) | current+history=partially_answerable (global/statistical/temporal question; captions mention answer-related terms but may not cover enough events to verify the full comparison/order) | gain=no | bucket=not_self_first_or_unclear | global/statistical/temporal question requires conservative answerability | query_user is UNKNOWN, so self-first interpretation remains provisional"
HISTV1_023,36,"Who's the one that jokingly said, 'so much pressure' when they were told to do a grand opening decoration?","Jake, amused but concerned about the task.",social_interaction,UNKNOWN,unknown,unclear,unclear,unclear,no,not_self_first_or_unclear,current_plus_historical,"[all_agents_current rank=1 score=20.8472 source=Jake D1 21:43:30.00-21:44:00.00] sitting in my chair, I watched Lucia squeezing something, likely cream, while Alice stood by with her hands on her hips, observing the process. Tasha wondered if it was done, but Lucia said to wait a moment, and Alice jokingly called it a ""food symptom"" and ""moisture removal symptom."" Katrina held up a stool and looked at it. After Lucia finished squeezing, Tasha decorated the creation with fruit, suggesting we draw a smiley face on it. Lucia agreed to make another one. Tasha thought they were squeezing a bit too much and encouraged everyone to squeeze more, t...",no,"current=unclear (evidence has lexical overlap but does not clearly support the answer) | history=unclear (evidence has lexical overlap but does not clearly support the answer) | current+history=unclear (evidence has lexical overlap but does not clearly support the answer) | gain=no | bucket=not_self_first_or_unclear | query_user is UNKNOWN, so self-first interpretation remains provisional"
HISTV1_024,115,"When deciding on drinks, who suggested a 'big bottle' and why?","Jake, who said the big bottle could be finished.",social_interaction,UNKNOWN,unknown,likely_answerable,likely_answerable,likely_answerable,no,not_self_first_or_unclear,current_plus_historical,"[all_agents_current rank=1 score=11.0489 source=Tasha D3 16:52:00.00-16:52:30.00] Alright, here’s what I’m doing in this video: I’m in the grocery store, getting ready to pick out some drinks from the refrigerator. Jake says ""Oh,"" and I turned to look at him, responding with ""So?"". Violet appears. Jake is advising me to ""Buy the big bottle,"" and I suggest, ""Then let's buy one bottle."" Violet also joins us. Jake then changes his suggestion to ""Yeah, the small bottle."" I pick up a bottle of juice. Jake questions, ""I don't know, who can't finish it?"" I then look at Jake and Violet. Jake then added, ""The big bottle can be finished."" Suddenly,...",no,"current=likely_answerable (evidence covers most answer keywords and overlaps with the question context) | history=likely_answerable (evidence covers most answer keywords and overlaps with the question context) | current+history=likely_answerable (evidence covers most answer keywords and overlaps with the question context) | gain=no | bucket=not_self_first_or_unclear | query_user is UNKNOWN, so self-first interpretation remains provisional"
HISTV1_025,903,What misunderstanding did Alice have about the beverages at first?,She thought the drinks included sodas but later realized it was only water.,theory_of_mind,Alice,inferred_weak,partially_answerable,partially_answerable,partially_answerable,no,history_adds_useful_context,current_plus_historical,"[all_agents_current rank=1 score=6.9984 source=Lucia D3 11:40:00.00-11:40:30.00] The video starts with me taking a step forward after hearing Shure say, ""If I knew, I wouldn't have had coffee for this activity."" Shure then says, ""Wipe my tongue first."" I then comb my hair, and Katrina says, ""Wipe your tongue."" I turn my head to look at Shure, who is walking back and forth. Jake tells Shure to ""Wipe it clean,"" while Katrina is sitting on the sofa. Alice walks in from the stairway and approaches the table, saying ""What is this?"" She then says, ""This is..."" Looking back, I see Jake working on the whiteboard. Alice says, ""Soda water with what?...",unclear,current=partially_answerable (evidence covers some answer keywords but may not fully support the answer) | history=partially_answerable (evidence covers some answer keywords but may not fully support the answer) | current+history=partially_answerable (evidence covers some answer keywords but may not fully support the answer) | gain=no | bucket=history_adds_useful_context
HISTV1_026,915,Why was Katrina initially confused about what was happening with the ball during the game?,She assumed it would require manual intervention to release the ball.,theory_of_mind,Katrina,inferred_weak,partially_answerable,partially_answerable,likely_answerable,yes,current_plus_history_needed,current_plus_historical,"[all_agents_current rank=1 score=12.4274 source=Lucia D3 16:20:00.00-16:30:00.00] I started off completely absorbed in a round of Initial D Zero, fiercely gripping the steering wheel and making constant adjustments to stay on the virtual track, determined to win. I played hard, but after the race, the game ended, and I took a moment to adjust my glasses. Afterwards, there was a bit of discussion with Jake and Lucia about whether to play again, which I was reluctant about due to the card needing to be renewed. We realized we needed more coins and were just generally confused on how it worked, then decided to move on. I offered up the remain...",yes,current=partially_answerable (evidence covers some answer keywords but may not fully support the answer) | history=partially_answerable (evidence covers some answer keywords but may not fully support the answer) | current+history=likely_answerable (evidence covers key answer terms and strongly overlaps with the question context) | gain=yes | bucket=current_plus_history_needed
HISTV1_027,1013,Why did Jake try to direct someone to the 'first floor Huawei' during their shopping trip?,Because that was where the group had agreed to regroup.,theory_of_mind,Jake,inferred_weak,likely_answerable,unclear,likely_answerable,no,current_sufficient,current_plus_historical,"[all_agents_current rank=1 score=11.7679 source=Tasha D5 15:56:00.00-15:56:30.00] I began by walking behind Lucia within what appears to be a large, warehouse-style supermarket. I then moved forward, subsequently picking up a bag. I overheard Lucia remarking that the second floor of the supermarket resembled a warehouse. I then proceeded to activate my phone, at which point Jake mentioned the name ""Big Gui."" Immediately following this, I received a phone call, prompting Tasha to inquire ""Why?"". In response, Jake requested someone to dial the number. Jake then further stated, ""Dial, hey, he should be calling me."" Subsequently, I re-opened W...",unclear,current=likely_answerable (evidence covers key answer terms and strongly overlaps with the question context) | history=unclear (evidence has lexical overlap but does not clearly support the answer) | current+history=likely_answerable (evidence covers key answer terms and strongly overlaps with the question context) | gain=no | bucket=current_sufficient
HISTV1_028,861,Why did Jake joke about putting all the puzzle pieces in randomly while everyone else took the task seriously?,Because Jake wanted to test how mismatched the pieces would look.,theory_of_mind,Jake,inferred_weak,likely_answerable,likely_answerable,likely_answerable,no,current_sufficient,current_plus_historical,"[all_agents_current rank=1 score=13.1219 source=Shure D1 12:34:30.00-12:35:00.00] I observe Alice making observations about the assembly of an object, stating, ""It's not a perfect fit. Some are just approximate. Hmm, this time it's quite different."" Throughout this time, the group is seriously focused on the assembly task at hand. I quietly watch the others, and Jake suggests, ""How about we just put everything in? Haha, put everything in. Let's first see how much it mismatches if we just randomly put them together."" The collective assembly continues. Later, Katrina seems to join me in quietly watching the others. Then Tasha says, ""This bir...",unclear,current=likely_answerable (evidence covers key answer terms and strongly overlaps with the question context) | history=likely_answerable (evidence covers key answer terms and strongly overlaps with the question context) | current+history=likely_answerable (evidence covers most answer keywords and overlaps with the question context) | gain=no | bucket=current_sufficient
HISTV1_029,864,What made everyone laugh about the espresso conversation?,Lucia’s reaction to ordering a concentrated shot.,theory_of_mind,UNKNOWN,unknown,partially_answerable,partially_answerable,partially_answerable,no,not_self_first_or_unclear,current_plus_historical,"[all_agents_current rank=1 score=8.4103 source=Jake D1 13:35:00.00-13:35:30.00] The video begins with me asking, ""The coffee is ready, right?"" as I turn to my right, looking at the group of people in the room. I then confirm, ""Ah, the coffee is ready."" Shure replies, ""Seems like there's not much coffee."" I respond with, ""Oh, oh."" and look at everyone again. I then begin wiping the whiteboard with an eraser. Shure adds, ""And we can only make it by hand,"" to which I reply while still wiping the whiteboard, ""Then everyone can have a sip."" Turning my head to the left, I comment, ""Haha, a small cup is just one shot,"" and laugh, extending my rig...",no,"current=partially_answerable (evidence covers some answer keywords but may not fully support the answer) | history=partially_answerable (evidence covers some answer keywords but may not fully support the answer) | current+history=partially_answerable (evidence covers some answer keywords but may not fully support the answer) | gain=no | bucket=not_self_first_or_unclear | query_user is UNKNOWN, so self-first interpretation remains provisional"
HISTV1_030,866,Why did Jake ask if preserving ice cubes could be eaten?,Because he was genuinely confused about their purpose.,theory_of_mind,Jake,inferred_weak,unclear,unclear,unclear,no,history_irrelevant,current_plus_historical,"[all_agents_current rank=1 score=16.3274 source=Tasha D1 18:19:30.00-18:20:00.00] The video begins with me standing at the checkout counter, interacting with others as we unload groceries from our shopping carts. I make a waving gesture, stating, ""Yeah, yeah, it is. I'll bring this in and make a copy for you."" Alice then requests, ""Play something lighter,"" and in response, I say, ""Haha, I'll take this gear into the cinema,"" acknowledging her comment on the amount of stuff we have. Alice suggests, ""I think this is a bit too much,"" but Lucia counters with, ""It looks pretty cool."" Katrina chimes in with, ""Play some small drinks,"" while Alice...",no,current=unclear (evidence has lexical overlap but does not clearly support the answer) | history=unclear (evidence has lexical overlap but does not clearly support the answer) | current+history=unclear (evidence has lexical overlap but does not clearly support the answer) | gain=no | bucket=history_irrelevant
